creation_time,modified_time,post_owner.name,post_owner.username,id,media_id,statistics.comment_count,statistics.like_count,statistics.views,text,duration,tags,creation_time_tw,modified_time_tw,short_code,is_file_exist,DownloadTool
2025-01-03 09:20:13+00:00,2025-05-01 07:26:16+00:00,崔咪Tramy,b2btramy888888,2410565552705760,2410565552705760,22,,134550.0,"還有人去日本不知道要買這個嗎？
#必收藏但怕你搶不到

號稱按摩神器的大猩猩握，
給朋友們實測的結果是？

我個人心得，
段位有分三段，
我只能用到第二段不然真的會有捏爆感，
但是捏完腿好輕好舒服喔！

不要買另一款腳底按摩那個，
那個很雷🥺

🇯🇵猩猩握想要問 @back2british 

#日本  #日本直送  #日本旅行",67.03,"{'0': '1452740993119030', '1': '1424221669171081', '2': '26001416349498562'}",2025-01-03 17:20:13+08:00,2025-05-01 15:26:16+08:00,,Yes,MetaTool
2025-01-08 12:00:00+00:00,2025-02-16 02:30:02+00:00,崔咪Tramy,b2btramy888888,1456064369456078,1456064369456078,18,1593.0,27826.0,"年末是不是很多人要進廠保養🙌🏻
但我也有遇到姐妹問我，
有沒有平時保養就有差不多的效果，
還不能讓荷包瘦太多的～ 

大家可以看影片，
#巴黎萊雅A醇PRO小臉霜  一陣子後的臉，
是不是和醫美效果差不多! 

👉🏻一罐就加了A醇 PRO、
👉🏻維他命C精華和緊緻胜肽! 
三大醫美級成分加在一起就像打電波一樣，
由內而外把皺紋、
鬆弛部位全都撐起來，
再來是A醇PRO很有感縮短耐受期，
比起一般A醇肌膚緊緻、改善皺紋效果更強
尤其是又加上維他命C精華跟緊緻胜肽
可以延長緊緻抗皺效果，
臉的亮度、緊度也更up up！
而且一瓶就搞定早C晚A，超方便了啦！

這罐的質地水潤輕盈好推開💦

之前用過很多抗老霜太悶黏反而長痘
這瓶完全不黏膩而且吸收速度很快～！

重點是還千元有找CP值高到不行，
想要加強即時效果我就會睡前搭配簡單的按摩手法，
嘴邊肉啊、法令紋啊，改善超有感，
如果換季皮膚很不穩的話，
再搭配 #修護奇蹟露 使用，
👉🏻92%高濃度積雪草，
可以提高保水度，對舒緩泛紅、痘痘也蠻有感的
如果需要急救時拿來濕敷可以快速鎮定泛紅敏感

這樣的組合搭配真的是開架緊緻抗老王，
不敢做醫美或是想要維持緊緻狀態的，
用這個可以很捨得擦臉擦身體！

限時優惠🔗這裡給你們喔
@b2btramy888888 限動

#巴黎萊雅 #A醇PRO小臉霜
 #擦的電音波 #臉小１號7天減齡 #修護奇蹟露",89.6,,2025-01-08 20:00:00+08:00,2025-02-16 10:30:02+08:00,,Yes,MetaTool
2025-01-15 03:27:00+00:00,2025-02-16 02:30:02+00:00,崔咪Tramy,b2btramy888888,903011985664896,903011985664896,21,1658.0,24958.0,"不用去韓國做水氧機了，最近肌膚狀況真的超好！每次卸妝洗臉後，肌膚不僅乾淨，
還透亮得不得了，完全是大放光芒！

今天要跟大家分享，
我最近愛上的兩款簡單卸妝保養好物，
所有膚質年齡都適合，每天都會用到
讓我肌膚好到讓人忍不住摸！

🔥限時團推三件組（卸妝2+精華水1）🔥
加碼10包旅行組
https://pse.is/6yw957
（看 @b2btramy888888  限動精選）

———————————————————————-
推薦原因❤️💛

這瓶算是我用過最好用的卸妝產品，
完全不用乳化，一次卸妝+洗臉
⚠️卸妝是基本保養的第一步驟
用錯產品就是痘痘粉刺/紋路/暗沉/找上你

#茶覺金萱植萃保濕卸妝凝露
這款卸妝凝露我超愛，因為它不僅能卸妝，
還能洗臉和養膚，真的是一瓶搞定！
茶覺是全台唯一以茶為基底的護膚品牌，
真的很有特色。它的成分超乾淨，
讓我用起來超放心

✅金萱茶多酚：強效抗氧化，幫助清潔肌膚，同時滋養
✅積雪草：加強肌膚保護屏障，抗老抗污染。
✅APG溫和型界面活性劑：溫和卸妝，不刺激眼睛，適合敏感肌

我眼妝比較濃時會先在化妝棉上點幾滴，
稍微敷一下，再輕輕擦掉眼妝，
完全不會掉睫毛，
眼睛也不會有刺痛感！
而且它不用乳化，直接清水沖掉就好，
超級方便！卸得很乾淨，
不會緊繃，臉摸起來嫩嫩的，
感覺整個肌膚變水嫩！

#東方美人潤澤修護凝露
卸完妝後，我會擦上這款修護凝露，
真的是超愛！它的質地比化妝水濃一點，
有淡淡的茶香，質感超棒

✅東方美人茶多酚：溫和抗老、亮白，讓肌膚更透亮
✅專櫃級保養冰河海醣蛋白（5%高濃度）：
超級保濕，增強肌膚屏障
✅日本清酒酒粕：
加強鎖水，修護提亮

換季或熬夜後皮膚容易暗沉、
乾裂，這時候用這款潤澤修護凝露，
皮膚立刻恢復光澤，保濕效果超強！
脖子也別忘了擦上，效果更好！
我甚至會用化妝棉濕敷3-5分鐘，
當作急救精華水來用，
效果超快！這款真的讓我覺得，
肌膚亮白、細緻感超強，
像是做了水氧機一樣，瞬間回春！

兩款搭配使用，
讓我一整天都保持水潤亮白，
肌膚變得超級柔嫩，
簡直是懶人保養的最佳選擇！
如果你也想輕鬆擁有透亮肌，
這兩款一定要試試💯

@chaj_tw 

#茶覺",88.65,{'0': '947638931028350'},2025-01-15 11:27:00+08:00,2025-02-16 10:30:02+08:00,,Yes,MetaTool
2025-01-21 13:19:37+00:00,2025-07-03 14:15:43+00:00,崔咪Tramy,b2btramy888888,1651902965966663,1651902965966663,10,,95822.0,"今天帶大家去西班牙巴塞隆納的超夯精品Outlet，
這裡簡直是購物天堂！想買到最便宜的精品？

秘密來囉！首先，要做這件事情（看影片）
這時候最高能打到50% off！
而且，記得拿上你的護照，
還能享有額外的退稅優惠，等於買得更多！

有些品牌還會舉辦限時特賣，
便宜得你想哭！

你們看完想去嗎，和我分享囉

#西班牙 #巴塞隆納  #精品",59.84,,2025-01-21 21:19:37+08:00,2025-07-03 22:15:43+08:00,,Yes,MetaTool
2025-01-29 09:42:57+00:00,2025-02-16 02:30:02+00:00,崔咪Tramy,b2btramy888888,1622996602230397,1622996602230397,8,,33184.0,"春節不知道去哪裡，直接去Netflix 國色芳華，
裡面牡丹園的場景吧！
#此篇必收藏 

姐妹們，
最近追《國色芳華》有沒有被劇中的牡丹美得不行？
那一朵朵盛放的牡丹，
真的是美得讓人心動啊！

如果你也愛牡丹花，
苗栗的花露農場也有超美的牡丹花喔！
不僅花海美得讓你心情大好，
還能在這裡拍出像劇中那樣的仙氣照片，
完全是牡丹愛好者的天堂！🌸

花露農場 @annflowerhome 
還有住宿，可以一早就先拍賞花照！

你們也在追這部嗎？
我等更新等的好心急啊🫣

#臺灣  #臺灣旅遊  #苗栗景點  #苗栗旅遊  #牡丹  #國色芳華",70.33,{'0': '819195590688098'},2025-01-29 17:42:57+08:00,2025-02-16 10:30:02+08:00,,Yes,MetaTool
2025-02-01 12:02:12+00:00,2025-09-03 04:38:02+00:00,崔咪Tramy,b2btramy888888,964799799555982,964799799555982,10,,46751.0,"來日本第一次做這件事情🫣

在日本做這件事情的價格蠻高的，
但是如果逛街逛到累，
是可以考慮啦！

你們會想來日本做這件事情嗎？

#日本東京  #日本  #東京",70.1,,2025-02-01 20:02:12+08:00,2025-09-03 12:38:02+08:00,,Yes,MetaTool
2025-02-03 12:59:33+00:00,2025-09-06 01:37:06+00:00,崔咪Tramy,b2btramy888888,2079634616148172,2079634616148172,12,1597.0,27228.0,"過年一追劇，眼睛就一直吃不消對吧？
別以為隨便處理就沒事了，
這樣下去真的是會出大問題的！
所以，葉黃素真的要早點補充，
因為這東西是人體自己沒辦法製造的，
必須透過外部補充才行⋯

很多人問我怎麼選葉黃素，
我的選擇很簡單，
就是挑最好的！

我現在用的就是日安專科專利游離型葉黃素，
這是美國專利的葉黃素黃金比例，
吸收超級好。它有游離型的小分子，
能快速被身體吸收，效果才會明顯。
而且，
它還加了很多其他牌子不願意加的成分：
像是比黃金還貴的蝦紅素和透明質酸鈉，
讓有感度是其他產品的1000倍以上，
靈魂之窗真的會變亮又有神！
還有加入很多專利植物萃取加乘效果，
完全是一個懶人包的概念！

對我這種天天用手機、電腦，
還長時間看電視的人來說，
這就是救命神器。
畢竟眼睛是心靈的窗戶，
眼周的亮晶晶才是健康和精氣神的象徵，對吧？

現在加入會員即享100元購物金
透過專屬連結下單再贈天然海藻鈣鎂錠1包
如果你也常看手機、用電腦，就趕快試試看吧！
https://daywel.co/tramy

#日安專科 #daywel #日常保健 #安全健康有感 
#專利游離型葉黃素",78.27,,2025-02-03 20:59:33+08:00,2025-09-06 09:37:06+08:00,,Yes,MetaTool
2025-02-09 10:52:17+00:00,2025-06-20 01:57:06+00:00,崔咪Tramy,b2btramy888888,1147603790676414,1147603790676414,2,,21563.0,"大家去泰國買美妝都買什麼？
很推薦大家買「防水」產品，
因為天氣熱超容易脫妝，
他們很多像是眉筆眼線都會更持久！

來實測我新買的百元泰國品牌眉筆，
看完你們想要嗎？😝

你們去泰國都買什麼呢

#泰國  #美妝  #眉筆",62.37,,2025-02-09 18:52:17+08:00,2025-06-20 09:57:06+08:00,,Yes,MetaTool
2025-02-10 14:14:37+00:00,2025-05-29 20:21:50+00:00,崔咪Tramy,b2btramy888888,1465636514957054,1465636514957054,12,,18688.0,"朋友問我怎麼臉又變小，輪廓變緊了，
用巴黎萊雅 #全新膠原小蜜罐 ，
補充5D寶寶膠原，就像幫肌膚充電，
彈性up 緊緻up 年輕 up !
限時優惠連結🔗看限動，
最推 買2贈7 （還有迷你旅行化妝箱）",3996.22,,2025-02-10 22:14:37+08:00,2025-05-30 04:21:50+08:00,,Yes,MetaTool
2025-02-16 12:29:26+00:00,2025-02-20 14:40:51+00:00,崔咪Tramy,b2btramy888888,2086900968519709,2086900968519709,3,,31942.0,"泰國銅板價美妝保養選物店！
最便宜才29元，
真的甜到蛀牙價！

去曼谷記得要去逛喔

#eveandboy #曼谷",61.25,,2025-02-16 20:29:26+08:00,2025-02-20 22:40:51+08:00,,Yes,MetaTool
2025-02-20 14:32:31+00:00,2025-04-27 17:42:15+00:00,崔咪Tramy,b2btramy888888,843972022018741,843972022018741,10,,24728.0,"歡迎來到我的新家🤣🤣🤣
。
。
。
如果是就好了

來西班牙住最豪華的民宿，
有非常多的電影在這裡取景，
而且佔地百坪以上，
真的處處是細節！

韓團 #newjeans  也有來過拍攝喔

想知道怎麼租，
留言在「想知道」我會告訴你！

#西班牙  #西班牙住宿  #海外旅行",85.54,,2025-02-20 22:32:31+08:00,2025-04-28 01:42:15+08:00,,Yes,MetaTool
2025-02-23 09:38:10+00:00,2025-03-30 06:43:20+00:00,崔咪Tramy,b2btramy888888,4527439864146478,4527439864146478,251,,67793.0,"熟了熟了🤣🤣🤣
最近超紅的微波爐加熱轉場！
把無聊的照片變得好有趣🙌🏻

想學留言給我吧！

#特效轉場  #崔咪愛漂亮",20.3,,2025-02-23 17:38:10+08:00,2025-03-30 14:43:20+08:00,,Yes,MetaTool
2025-02-26 15:19:04+00:00,2025-05-29 18:07:37+00:00,崔咪Tramy,b2btramy888888,4457093621279895,4457093621279895,17,,241395.0,"日本美妝斷貨王！看到麻煩立刻收🙌🏻
#先收藏以免忘記

每次去必掃，
「DERMA LASER」是目前在日本最暢銷的面膜系列，
之前都會囤他們家面膜，
DERMA LASER SUPER VC100 面膜，
一天只要三分鐘，真的不浪費時間~

上次去眼膜還缺貨，跑了幾家才買到，
DERMA LASER EYE SHEET SUPER VCR眼膜
也好好用!眼下紋路真的會變淡~
而且比其他家大片精華液多很多!

Kate出的怪獸唇膏，
三色我之前都沒有買齊😣

看完和我說你們買過什麼，
還有最想買什麼呢?

#日本美妝 
#qualityedit1st
#DERMALASER
#眼膜
#維他命C
#視黃醇
#穀胱甘肽",80.39,,2025-02-26 23:19:04+08:00,2025-05-30 02:07:37+08:00,,Yes,MetaTool
2025-03-03 02:59:38+00:00,2025-03-03 10:25:36+00:00,崔咪Tramy,b2btramy888888,1544657423276759,1544657423276759,16,1671.0,21612.0,"你們有沒有這種經驗？😱

每次要參加重要活動， 
光是頭髮就要砸好幾張小朋友去沙龍報到， 
不然根本不敢出門見人！ 

我本人因為熱愛折騰自己，漂染、電棒、 
平板夾輪番上陣， 
結果頭髮乾到可以直接參加稻草人選美比賽， 
風吹過來還會沙沙作響（誰來救救我？😣) 

某天，我去找明星造型師求救， 
本來以為他會叫我戒掉造型工具， 
結果他神秘地湊過來， 
壓低聲音說👩‍🦳
「想造型又不想毀髮？選對洗護產品才是關鍵！」 
然後他就拿出 沙宣大紅瓶深層滋潤洗護系列， 
像是在展示什麼護髮界的聖杯一樣。 
我半信半疑地回家試用， 
結果，真的不得了！ 

這瓶洗髮精的滋養程度根本就是 
「髮界的頂級乳霜」，
但是使用完全不會黏膩 
裡面滿滿的角蛋白， 
直接滲透進髮芯， 
讓我的稻草瞬間變身絲絨！ 
再搭配 沙宣深層滋潤潤髮乳， 
連分叉和斷裂都大幅減少， 
頭髮摸起來柔順得像剛做完昂貴的沙龍護髮一樣，
重點是 ～香味超高級，還會自帶女神光環！ 

現在造型前， 
我只要乖乖用這組洗護， 
頭髮就能維持在 「隨時可被男神撩髮」 的狀態， 
重點是-少少的錢就能有沙龍級的護髮效果， 
再也不用為了護髮吃土！ 

大家還不快試試， 
讓我們一起從「稻草系女孩」進化成「絲絨系女神」吧！ 

#沙宣大紅瓶  #沙宣無界美麗無限

 @vs_taiwan",89.21,,2025-03-03 10:59:38+08:00,2025-03-03 18:25:36+08:00,,Yes,MetaTool
2025-03-04 03:47:13+00:00,2026-01-15 11:57:16+00:00,崔咪Tramy,b2btramy888888,25943046918651420,25943046918651414,0,2.0,492.0,"韓國女星愛用！懶人必備💉擦的美白水光保養

🔗https://www.trusteebio.com.tw/one-page-stores/TRAMY 🔥
@b2btramy888888 首頁也有連結
最推2+2組合，下單還有加碼🎁

實際使用一陣子下來。
用完皮膚亮好多
摸起來粗粗顆粒變平滑
亮白保濕膚色均勻=會呼吸的毛孔+發光水光肌，
用了一個月皮膚比去做1美還要好！

說真的，我也有想偷懶的時候，
每天保養只想快速搞定，
但偏偏年紀到了，膚色容易暗沉、膚況粗糙，
加上只要熬夜、壓力大皮膚就是暗/垮/乾
要水光肌真的不容易🥲

直到用皙麗可亮白爽敷棉＋爆水霜，
洗完臉-亮白爽敷棉-（精華液看個人）-亮白爆水霜
才發現，原來美白可以這麼簡單！

這次直接找台灣品牌代理爭取到史上最甜價，
只有7天！
平常只能飛韓國藥局買，
現在不用出國也能入手🔥

—————-

最推薦「亮白爽敷棉2＋爆水霜2」組合！✨

✔ 亮白 ✔ 保濕 ✔ 透亮 ✔ 妝前服貼 ✔ 去角質

🔹 亮白爽膚棉（每天擦，皮膚真的變細！）

第一個讓我驚艷的就是這款 「能擦能敷」的爽膚棉！
兩面設計，效果超強👇

💎 壓花面 👉🏻 我固定用來去角質，每週2-3次
✔ 軟化老廢角質，改善粗糙
✔ 溫和代謝黑色素，皮膚更透亮

💎 柔軟面 👉🏻 每天早晚擦拭，當化妝水濕敷更有效！
✔ 含專利美白成分，滲透肌底，讓亮白更持久！
✔ 每次用完，臉真的亮一階，皮膚摸起來也更光滑！

🔥 重點！不起毛、不刺皮膚，連敏感肌都能用！

👉🏻 內含4大美白成分，全面擊退暗沉！
✔ 傳明酸：阻斷黑色素形成，讓膚色均勻透亮
✔ D-甜沒藥醇：抑制黑色素生成，防止色素沉澱
✔ 水楊酸：溫和代謝角質，油水平衡
✔ 菸鹼醯胺：舒緩保濕，修護肌膚屏障
————-

🔹 亮白爆水霜（瞬間吸收，輕盈不厚重！）
 1美術後也可以用🙌🏻❤️

這罐真的讓我驚艷！軟管包裝好攜帶又可以用到最後一滴，一開始看起來很濃厚，結果推開瞬間變成水精華狀，超級好吸收！有淡淡的草本香味，
所有膚質，早晚都可以用！

✔ 美白＋保濕＋舒緩，一瓶搞定！
✔ 不油、不悶，完全不會有傳統美白霜的黏膩感！
✔ 約會前一天厚敷，隔天起床皮膚真的亮！
✔ 妝前擦一層，粉底更服貼、不暗沉，根本隱形打光！

💡 我超愛的用法：
🔥 晚安面膜 👉 厚敷過夜，第二天起床皮膚超透亮！
🔥 上妝前 👉 薄擦一層，妝感超貼不卡粉！
🔥 補妝用 👉 帶出門，下午保濕+提亮，一抹就回到早上剛上妝的狀態
—————

🎁 下單加碼
✔ 2+2組合 👉🏻 再多亮白面膜！
✔ 滿2500參加精品包回饋活動！

⚠ 這次開團後要等6-8個月才會再開，
錯過又要等超久！
📩 下單✅截圖私，直接入團！

還有亮白精華液＋面膜組合🔥 
韓國排行榜第一名！
如果想要更快見效，一定要一起帶！

📢 這組真的太好用了，趁6折優惠一定要囤！
💖 快跟上，讓你的皮膚也能「擦」出韓星級水光肌！✨

#皙麗可 #團購",89.42,,2025-03-04 11:47:13+08:00,2026-01-15 19:57:16+08:00,,Yes,MetaTool
2025-03-04 14:05:00+00:00,2025-10-31 12:53:28+00:00,崔咪Tramy,b2btramy888888,932872139222001,932872139222001,36,,220384.0,"每次用濾鏡在自拍時的內心OS⋯

你們屬於哪一種🤣🤣🤣🤣

#濾鏡  #崔咪愛漂亮",11.82,{'0': '3196587423852312'},2025-03-04 22:05:00+08:00,2025-10-31 20:53:28+08:00,,Yes,MetaTool
2025-03-06 11:58:57+00:00,2025-05-29 14:31:42+00:00,崔咪Tramy,b2btramy888888,4252798131676347,4252798131676347,0,16.0,2817.0,"去日本必買藥妝！整理給大家囉！
#記得追蹤我會有新知

#崔咪愛漂亮",64.47,,2025-03-06 19:58:57+08:00,2025-05-29 22:31:42+08:00,,Yes,MetaTool
2025-03-16 07:34:53+00:00,2025-04-26 03:34:05+00:00,崔咪Tramy,b2btramy888888,2253291991868660,2253291991868660,9,,28623.0,"有些化妝技巧，如果跟著畫出門，真的會是災難！
#彩妝誤區
#收藏起來以後會用到 

整理給大家
/水光肌底妝
/唇周畫大
/看影片才知道的隱藏誤區

你們曾經畫過哪些出門過呢？
我好像除了最後一個，
其他都畫過，
水光肌底妝在韓國很合理，
但是台灣很潮濕，
真的很像出油到可以炒菜🤣

#崔咪愛美妝  #美妝  #美妝分享",77.74,,2025-03-16 15:34:53+08:00,2025-04-26 11:34:05+08:00,,Yes,MetaTool
2025-03-16 13:00:00+00:00,2025-12-02 12:18:06+00:00,崔咪Tramy,b2btramy888888,1428510742107260,1428510742107260,10,1619.0,26668.0,"說實話，我曾經也是醫美菜鳥，
迷信那些看似神奇又便宜的電波拉皮，
結果差點讓我變成「半臉凍雕」。
 
很久以前，
在網上看到某診所
大力宣傳便宜又快速的電波神器，
我心想：「這下省錢又變美！」
結果，體驗時臉上一陣熱痛，回家還輕微灼傷，
感覺膠原蛋白根本沒來訪，
真的是“花錢+傷痛”並存啊！
 
後來看新聞，警方連續破獲假電波機器，
看到那些受傷案例，
我整個人心臟差點跳出來。
經過一番折騰，我決定不再冒險，
轉而投靠正宗的美國鳳凰電波。
 
鳳凰電波不只是單極電波的創始者
它更擁有70多項專利和70幾篇的醫學文獻背書，
確定效果和安全性，
身為正宗美國電波拉皮領導品牌
更有美國FDA的認可，
真正讓我感受到膠原蛋白的補給，
臉部輪廓線也維持得更持久，
比起那些標榜速成便宜的其他款，
只有假性緊緻而沒有真的膠原，
只能撐三個月的
效果堪稱天壤之別！
 
除了產品本身，
探頭的認證也是關鍵。
有次我在診所看到有人為了多賺錢，
竟然用上了違法改造的舊探頭，
結果可能沒有效 ，
臉上還出現各種奇怪問題，
差點哭出來😢
 
從那以後，
我每次都會用官方LINE掃QR code驗證探頭，
確保不會遭到山寨危害～
但聽說現在居然連QRcode都有假，
所以一定要用官方line相機去掃碼
沒有看到官方line
或最後驗證是第1次使用的原廠探頭，
也要小心!
 
還有，選診所就像找對象，
不能只是聽到對方話術說說就信了，
還得有原廠真認證！

我自己每次施打前，
都會上原廠官網查詢認證診所，
因為聽說非認證診所八成有假，
誰願意冒這個險呢？
 
價格固然重要，
但真的有效果也還要安全和安心更是關鍵，
我們在變美的路上，
千萬別因為便宜或好奇心而踩雷！

選對產品、挑對診所，驗證探頭
這樣才能讓我們既美得耀眼，又笑得坦然。
一起做個有質感又安心的美麗女神吧！

#美國正宗 #鳳凰電波 #只有原廠認證診所才是真鳳凰",93.11,,2025-03-16 21:00:00+08:00,2025-12-02 20:18:06+08:00,,Yes,MetaTool
2025-03-17 10:00:00+00:00,2025-05-29 18:00:33+00:00,崔咪Tramy,b2btramy888888,1453787579461109,1453787579461109,38,,38288.0,"醫美後的乾荒大爆炸？這招救妳！

每次醫美後，
照鏡子都覺得自己像是被沙漠親吻過，
額頭、臉頰緊繃到懷疑人生，
化妝還卡粉卡紋，
怎麼補水都覺得皮膚在跟妳翻白眼，
更慘的是，乾到敏感、泛紅、甚至還會長小疹子，
這到底是變美還是變成仙人掌🌵

別怕，妳的肌膚救星來了！

日本 JCprogram 彈潤水光系列 ，
簡直就是#擦的水光針，
裡面可是有 1:1 水光針原液，
由日本自由之丘醫美專業醫生研發，
補水鎖水的能力強到讓妳感動流淚，
它不只幫助舒緩術後敏感，
還能讓皮膚透亮有彈性，
適合像我一樣臉容易乾燥又愛發紅的水逆膚況

我的私房用法，偷偷告訴妳！

第一步，用 JCprogram 彈潤水光精華液按摩全臉，
它含有 EGT 【麥角硫因】（這可是抗老界的 VIP）
+ 45 種肌膚需要的營養成分，
邊按摩邊感受臉蛋回春的奇蹟，
再用手溫熱按壓，
讓保水成分乖乖滲透到肌膚底層～

如果妳的臉頰乾到像秋天的落葉，
那一定要再加一層 JCprogram 彈潤水光霜，
裡面有雙重保濕成分 角鯊烷 +玻尿酸鈉，
外加複合多肽，
讓肌膚瞬間補水彈潤，
還能減少暗沉跟細紋～

✔ 剛擦完，皮膚水潤得像剛喝飽水的果凍
✔ 一陣子過後，妳會發現肌膚真的在發光，
上妝更服貼，毛孔也變細緻了！
✔ 持續使用，完全像是剛做完水光針，
Q 彈透亮到讓人忍不住多摸幾下

重點來了！現在屈臣氏獨家開賣，
免飛日本就能買到！ 
想知道有什麼優惠？
留言 「想要」，我給妳驚喜！

@watsonstaiwan
#JCprogram #屈臣氏獨家 #watsons #彈潤水光精華液
 #彈潤水光霜",89.88,,2025-03-17 18:00:00+08:00,2025-05-30 02:00:33+08:00,,Yes,MetaTool
2025-03-26 10:00:00+00:00,2025-09-15 04:06:04+00:00,崔咪Tramy,b2btramy888888,1315348853748054,1315348853748054,41,2128.0,36240.0,"#文末有🎁 開箱網上爆紅熱賣的金氣墊！直接實測8小時⋯

這次去香港帶了這顆金氣墊，
我的色號是001，
一拍就有遮瑕力，不會太S白，
粉體非常細緻，上臉也很均勻，
不卡不浮，
好像我的肌膚原本就是這麼有光澤一樣，
而且不用定妝，
等一下他會自己成膜，
你用手指摸也不會有痕跡，
上妝的效果很滿意！

當天天氣超級熱，出油流汗都是基本的，
但我到晚上的底妝都還是很完整，
鼻翼稍微出油用面紙壓一下就好，
奶油光很美，連老公都稱讚，
時間愈久會像自己的天生無暇好皮膚，
喜歡持妝度好，可以到屈臣氏衝這顆！

底下隨便說什麼，回饋一名給你們！🙌🏻

 @skintifictwn #skintific #金氣墊",87.54,{'0': '1477965007085451'},2025-03-26 18:00:00+08:00,2025-09-15 12:06:04+08:00,,Yes,MetaTool
2025-03-27 10:23:24+00:00,2025-09-04 10:10:33+00:00,崔咪Tramy,b2btramy888888,1569537660825900,1569537660825900,138,,36125.0,"突擊辦公室！韓國女生怎麼維持身材！！
#韓國爆燃小綠水 崔咪首發團-4/7

在韓國是OLIVE YOUNG賣到斷貨的好物!
韓國女生身材管理必備，
可以激化體內的爆燃能量，
代替飲料手搖飲，愈喝愈美愈薄片~

一天一包直接倒入水壺或是礦泉水(350CC)，
當成維他命水來喝，
不僅健康又多功能，
又同時燃燒不想要的部位堆積，
到了一定年紀，體重/體脂數字
想要漂亮真的很難，
我自己持續喝一年了,
可以順利變得更薄一點，
所有的數字也會更好看，
還有我的腰身!真的太滿意~~

如果常常會吃外食或是大餐的人，
更要每天補充一瓶小綠水，
我自己每天都會泡一瓶，
喝起來很好喝，就像檸檬水，
還有很久都沒變化的體脂數字，
在我努力第一個月時候竟然有變漂亮，
所以才會持續喝

也有很多人分享，
如果搭配運動一起喝
，能量活力可以維持，
連體重數字都有達到心中的標準!

💚韓國爆燃小綠水
👉🏻 https://reurl.cc/VYEdWY
@b2btramy888888 首頁也有🔗

獨家一週團友價，不用飛韓國最優惠
一盒28包，建議2盒起

🏆6盒最優惠最推薦
加碼贈送水瓶+小黃水10包入*2+
即飲健康堅果奶昔7袋入*1包

#身材管理 #體型 #瘦 #韓國瘦身",54.05,{'0': '1229174762003283'},2025-03-27 18:23:24+08:00,2025-09-04 18:10:33+08:00,,Yes,MetaTool
