creation_time,modified_time,post_owner.name,post_owner.username,id,media_id,statistics.comment_count,statistics.like_count,statistics.views,text,duration,tags,creation_time_tw,modified_time_tw,short_code,is_file_exist,DownloadTool
2025-09-07 12:46:25+00:00,2025-09-13 15:46:33+00:00,黃山料,iam_3636,1289581816465817,1289581816465817,103,12008.0,377204.0,"談戀愛並不只是「吃飯、約會、看電影」，兩個人在一起，最重要的是「解決問題的能力」
 
因為兩個相異的個體，要合而為一，過程一定是不舒服的。會有幾百次意見不同、幾十次的互相不理解、和好幾次想分開、想放棄的念頭。
 
如果你只有吃飯、約會，這種「一起玩的能力」，根本不夠應付感情一路上的各種難關，於是你的戀愛只會開始於顏值，並結束在交流生活、磨合人生觀的時候。
 
感情幸福的背後，更多的是在經營、在溝通、在協作，不斷的主動坦白自己，也接住彼此的情緒。如果不能持續的解決問題，而是冷處理、放任問題腐爛在心裡，那麼每一道難題會積累在心中，直到某一天，再也承受不了，就走不下去了。
 
到了一個年紀，你遇見過許多人，也曾經分分合合，放棄過幾個不適合的人，那你有沒有問過自己「什麼才是對的人？」其實，願意主動解決問題的兩個人，就永遠都不會走散，那就是對的人。
 
 
 
作者 #黃山料
新書《 #把日子慢慢變好 》",78.03,"{'0': '4108289472817671', '1': '1405375394659153'}",2025-09-07 20:46:25+08:00,2025-09-13 23:46:33+08:00,DOTS-5MiWl7,Yes,Instaloader
2025-09-14 12:48:04+00:00,2025-11-21 15:44:17+00:00,黃山料,iam_3636,2501200736942089,2501200736942089,100,10779.0,388425.0,"不要跟我道歉，請你想辦法彌補。
 
最讓人灰心失望的三個字是「對不起」，你犯了錯，道歉之後，要我原諒。但這對我是不公平的，因為這等於是要我吞下你在我身上造成的負面損傷。
 
你都說對不起了，我能不原諒嗎？
我不原諒，是不是就成了我的問題了呢？
 
就算我原諒你了，不代表我們可以回到原點。你在牆上鑿了一個坑，你道歉了，我原諒你了，但你要想辦法把牆壁抹平，我們才有可能回到原點。
 
當你犯錯或內疚的時候，如果你在乎這段關係，不要對不起，只要為我做一些事情，主動重新加深我們的感情：
 
第1、 做一些能讓我感覺到你對我的在乎的事情，因為我之所以能被你傷到，就是因為我在乎你，我也同樣需要你給我同等的在乎。
 
第2、 請你去把你自己製造的問題解決，並主動提出補償方案來找我討論，如果你暫時無法做任何事，就欠我一份人情，下次你要答應我一個要求。
 
《心很小 裝喜歡的事就好》寫說：
 
最糟糕的處理方式就是「我都道歉了，你不接受我也沒辦法」，因為，你過去了，不代表我過去了。
 
傷痕如果沒被及時解決，都會是關係中累積的未爆彈，當累積過多，崩塌以後，就再也無法挽回了。你要慶幸我還願意在這裡跟你糾結，當一個人不糾結了，不在乎了，不愛了，那都是不可逆的喔。
 
不要跟我道歉，請你想辦法彌補，
請珍惜每一個還能被你傷到的人，
會為你所傷，是因為我仍然，非常，在乎你。
 
.
 
作者 #黃山料 
書《 #心很小裝喜歡的事就好 》",81.7,"{'0': '4108289472817671', '1': '1405375394659153'}",2025-09-14 20:48:04+08:00,2025-11-21 23:44:17+08:00,DOlUr0OCT9h,Yes,Instaloader
2025-09-21 12:45:09+00:00,2025-09-27 08:05:16+00:00,黃山料,iam_3636,1669472550840071,1669472550840071,112,14298.0,371735.0,"你不可能找到一個完美對象。
 
每一個人都是立體的，
有優點就有相對應的缺點。
你享受了他的優點，
就要理解他的缺點。
 
《餘生是你 晚點沒關係》寫說，
 
「挑一個對象，不要看他的優點，要看他的缺點，看他最糟糕的樣子你能否接受。因為優點你當然沒問題，但雙方的缺點往往就是未來一段關係的考驗點。」
 
「但是，
如果我對我現在的伴侶非常挑剔，
那很可能有問題的是我，
因為這個伴侶也是我親自選擇的。」
 
《把日子 慢慢變好》書裡寫說，

「與其抱怨自己的伴侶很差，不如去想想自己出了什麼問題，才只能待在這樣的伴侶身旁？愛自己所選，不愛就離開，愛了就不怨懟。」
 
有得必有失，珍惜眼前。
 
 
作者 #黃山料
新書《 #把日子慢慢變好 》",74.4,"{'0': '4108289472817671', '1': '1405375394659153'}",2025-09-21 20:45:09+08:00,2025-09-27 16:05:16+08:00,DO3Vv9piYZ7,Yes,Instaloader
2025-09-28 12:23:29+00:00,2025-11-21 15:44:02+00:00,黃山料,iam_3636,1185003190069481,1185003190069481,74,8933.0,245486.0,"「只要兩個人的頭腦裡，沒有分開的念頭作為選項，就不會分手」
 
一旦有了「無論如何我們都要在一起」的思想鋼印，那麼，就算遇到難關，兩個人會選擇解決問題，而不是輕易放棄。
 
《 #把日子慢慢變好 》書裡寫說——
願意主動解決問題的兩個人，就永遠不會走散。
 
在一起或分開，都只取決於兩個人想不想要而已。
 
作者 #黃山料",88.35,"{'0': '4108289472817671', '1': '1405375394659153'}",2025-09-28 20:23:29+08:00,2025-11-21 23:44:02+08:00,DPJVCUziUh_,Yes,Instaloader
2025-10-06 12:12:55+00:00,2025-10-06 15:13:03+00:00,黃山料,iam_3636,2332918980542933,2332918980542933,83,9117.0,317140.0,"被疼愛的人，情緒可能比較穩定，因為得到足夠的愛與信任，有安全感，所以不會急著捍衛自己、不會焦慮的解釋自己。
 
缺愛的時候，只要一句話不順心意，就容易暴跳如雷，因為負面狀態時時保持在臨界點，隨時稍微一個立場不同，都會使情緒爆炸。
 
但渾身充滿愛的時候，即使被誤解了、遇到立場相反的人，也會很有耐心的尊重對方、溫柔的表達自己與對方不同。情緒毫無波瀾。
 
因為被愛，所以有底氣「慢慢來」，能不疾不徐的好好表達。因為被愛，所以我整個人變得從容不迫。
 
因為不需要花大把力氣面對負面情緒跟不安全感，所以多了很多耐心，因為精神上很有餘裕，所以對周遭就特別溫柔，
 
因為得到的愛很穩定，於是能相信世界是美好的，就也不自覺的用了溫暖的態度面對世界。
 
所以，即使被他人批評、遇到糟糕的事，也可以快速調整好心情，因為已經很幸福，那些糟糕的事又算什麼呢？
 
《把日子 慢慢變好》書裡寫說——
那些有錢的人，可以比較善良，因為他們不缺錢，就不會跟人爭。那麼，有愛的人、被疼愛的人，當然也就比較溫柔，因為他們不缺愛，就能情緒穩定的給出愛。
 
祝福你，
成為一個能情緒穩定的愛著別人的人，
也遇見一個情緒穩定的愛著你的人。

 
作者 #黃山料
新書 《 #把日子慢慢變好 》",79.64,"{'0': '4108289472817671', '1': '1405375394659153'}",2025-10-06 20:12:55+08:00,2025-10-06 23:13:03+08:00,DPd55i-CQEA,Yes,Instaloader
2025-10-12 13:05:21+00:00,2025-10-18 06:45:38+00:00,黃山料,iam_3636,1145293084213564,1145293084213564,136,27254.0,979172.0,"朋友有一個交往七年的對象，
他們去年結婚了，朋友說：
 
「在遇見他以前，
我可能因為過去的負面經驗，
而讓我對愛有很多懷疑，
打算不再談感情了，
交交朋友就好，不要太認真。
 
但遇見他以後，發現他是一個
「願意花大把時間慢慢打動我的人」
 
他不會覺得我的敏感讓他辛苦，
因為他理解我的不安，
不會因為我的心病而指責我，
他會留下來，陪我面對我的不安與情緒。
 
《把日子 慢慢變好》書裡寫說———
「慢慢來，才能過濾出真正珍惜你的人」
 
作者 #黃山料",72.96,"{'0': '4108289472817671', '1': '1405375394659153'}",2025-10-12 21:05:21+08:00,2025-10-18 14:45:38+08:00,DPtc9ROiSRS,Yes,Instaloader
2025-10-19 13:33:26+00:00,2025-11-21 15:42:34+00:00,黃山料,iam_3636,4142859179358897,4142859179358897,105,5811.0,193038.0,"愛情會重塑一個人的人生。

比如，遇見傷害你的人，你會變得不相信真愛。遇見疼愛你的人，你會轉而相信世界是溫暖善良的。所以我說，選對了人，愛對了人，你就有了第二人生。
 
《把日子 慢慢變好》書裡寫說
 
對的人會把你變回小孩，你可以任性，可以放心的撒嬌。經歷現實的大人常常不小心忘記了「期待」的情緒，因為不抱有期待的生活會比較平靜，所以我們活得灰暗且理智。幸好，仍然很幸運的，世間人海茫茫，一定總有人可以點亮我們。
 
《餘生是你 晚點沒關係》書裡寫說——
 
對的人，也風雨兼程，正在與你相遇的路上；
在那之前，好好過日子，一切自有安排。
 
當你被愛，你自然任性妄為。像小孩一樣。
當你不被愛，你就只能乖巧懂事。像大人一樣。
 
所以，慢慢來，
去等待一個讓你變回孩子的對象吧。",136.67,"{'0': '4108289472817671', '1': '1405375394659153'}",2025-10-19 21:33:26+08:00,2025-11-21 23:42:34+08:00,DP_hpHJiTIo,Yes,Instaloader
2025-10-26 12:10:50+00:00,2025-10-28 16:10:59+00:00,黃山料,iam_3636,1781048375906234,1781048375906234,72,7043.0,229036.0,"生氣翻臉，是為了表達界線，
教對方理解你的底線，而能更好的跟你相處，
 
不必害怕關係破裂，
因為發生衝突，是為了過濾出「願意留下來的人」
留下與你思想程度相當、能互相理解的人，
留下真正值得你珍惜的人。
 
「把話說開」也總是好的，
要不雙方更坦然相處，
要不雙方理解彼此相差過大而分道揚鑣，
兩者，都是好事。
 
如果有人因爲你的坦白，而選擇離開了你，
其實是命運在安排你，前往更好的地方，
而他跟你的道路不同了，因此命運安排了他的離去。
 
 
書
《 #把日子慢慢變好 》
《 #心很小裝喜歡的事就好 》",55.54,"{'0': '4108289472817671', '1': '1405375394659153'}",2025-10-26 20:10:50+08:00,2025-10-29 00:10:59+08:00,DQRZ2eaiSOv,Yes,Instaloader
2025-11-02 12:55:50+00:00,2025-11-21 15:42:19+00:00,黃山料,iam_3636,875261445281070,875261445281070,74,7004.0,215331.0,"曾經跟一個好朋友吵架，吵完後收到他寫的卡片，卡片上寫了一段話讓我想收藏一輩子，他寫說：
 
「你不需要對我發脾氣，我也會願意理解你的需要。你不需要帶刺，因為我不會傷害你。」
 
人際關係很複雜、出社會以後，我們不得已必須帶刺，才能保護好自己，但那些刺，也會不小心傷害了真正愛我們的人。
 
當你不斷刺傷他，他即使被你刺了，也緊緊抱著你，這個時候，你會反過來心疼著他，反省自己怎麼讓一個這麼愛我的人難過了？
 
因為愛的極致是心疼，是不希望對方傷心。當你真正愛一個人的時候，兩個人會收起脾氣，只希望讓對方幸福。
 
作者 #黃山料
書 #把日子慢慢變好
書 #心很小裝喜歡的事就好",83.03,"{'0': '4108289472817671', '1': '1405375394659153'}",2025-11-02 20:55:50+08:00,2025-11-21 23:42:19+08:00,DQjgkerifzE,Yes,Instaloader
2025-11-09 13:08:27+00:00,2025-11-21 15:42:04+00:00,黃山料,iam_3636,1225652712342134,1225652712342134,76,10757.0,323537.0,"伴侶之間「不可能每件事情都取得共識」，但至少要有心去理解伴侶為什麼跟自己想的不一樣，其實只要做到這個程度，就超值得繼續相處，因為世界上沒有真愛，只有「願意互相理解的兩個人」
 
當我們相愛卻一直鬧矛盾，很多時候，是你付出愛的方式，跟我期待獲得愛的方式不同。
 
有的人獲得愛的方式是被陪伴，是深度的對話，是報備或安全感，也有人是為你付出勞力、送禮物、或和你肢體接觸。
 
每個人需要的、付出的都不同，比如我用行動來愛你，你卻糾結我說得太少。我幫你準備禮物，你卻嫌我沒花時間陪你。
 
因為每個人的愛不一樣，所以彼此接收不到，你就算做了你的版本的100分，在我的主觀裡，因為那不是我要的，所以也許只感受到10分，所以我有缺失感，我有另外的90分沒被滿足。
 
那你也會很挫敗啊：「我做了那麼多，花光力氣了，為什麼你就是不滿意？」只因為，我們都用自己的方式在愛人。
 
我寫的書《心很小 裝喜歡的事就好》寫說：
愛需要冷靜下來去理解，而不是只憑感受。我要學會理解你正在用你的方法很努力的愛我，我們也要練習為彼此做自己能力範圍內的調整。
 
很多時候，你身邊的人不是不在乎你，只是缺乏理解、缺乏溝通、缺乏看見。我們與其盲目的尋找真愛，不如去找到「他付出愛的方式，你能夠理解」的那一個人吧！
 
.
.
 
作者 #黃山料

新書即將完成 ，下禮拜向各位公布😃",79.33,"{'0': '4108289472817671', '1': '1405375394659153'}",2025-11-09 21:08:27+08:00,2025-11-21 23:42:04+08:00,DQ1jiMVCRoX,Yes,Instaloader
2025-11-16 12:06:08+00:00,2025-11-18 15:16:17+00:00,黃山料,iam_3636,1222349526694713,1222349526694713,68,4814.0,190950.0,"如果你容易不安，這真的很正常，
每個人都有敏感、也都想控制，
都需要掌控一部分什麼，才能獲得安全感，
你的控制欲並沒有問題，
只是有的人掌控得比較神不知鬼不覺。
控得比較有智慧，不會讓人不舒服。
 
但很多時候，愛往往不是我們能掌控的，
只能冷靜下來，把愛交給時間去驗證。
不要讓自己活在對還沒發生的事的恐懼中。
 
 
// 
 
 
新書即將出版！
《 擁有過 就好：告別青春的最後一封情書 》
 
11/24中午12:00 開放預購親筆簽名書
我會在首頁資訊欄 放連結
 
 
 
#擁有過就好",63.72,{'0': '1405375394659153'},2025-11-16 20:06:08+08:00,2025-11-18 23:16:17+08:00,DRHdtl9D6mW,Yes,Instaloader
2025-11-23 11:55:38+00:00,2025-11-30 01:15:46+00:00,黃山料,iam_3636,1226085305629709,1226085305629709,74,11373.0,311283.0,"#沒有完美的愛
真正的愛多少都伴隨著傷害和破碎，
因為對方也是一個人，會有他的自私、
有和你不同的想法、會讓你失望。
 
這些爭執、裂痕隨處可見，
其實根本不是問題。
問題是，兩個人遇到衝突後，
會不會一起面對，一起走下去。
 
#所有關係都會有衝突
 
愛就是會讓你累、
會讓你懷疑現在的生活，
但是再怎麼意見不合，
即使氣到轉身離開，
氣消以後，
看到他喜歡吃的，就又想買給他。
 
我的新書《擁有過 就好》書裡寫說
 
每個人都一定會在愛裡犯錯，
而且，真正的愛
是發生在「犯錯以後的溝通」
是一次次的衝突後，
越來越理解彼此。
 
一次又一次把最真實的對方掰開，
走進彼此心裡，
看見彼此的破碎，
卻選擇在廢墟裡住下來。
 
你必須接受，
愛就是必然伴隨互相傷害，
同時，兩個人也互相修補，
才能相伴餘生。
 
新書 《 #擁有過就好 》 即將出版
首頁資訊欄有 購書連結！
 
希望你們會喜歡我寫的書 ^^",55.05,"{'0': '942539328200274', '1': '1405375394659153'}",2025-11-23 19:55:38+08:00,2025-11-30 09:15:46+08:00,DRZeSBHCYQb,Yes,Instaloader
2025-11-30 12:32:00+00:00,2025-12-02 15:52:07+00:00,黃山料,iam_3636,783063074835461,783063074835461,87,4559.0,161311.0,"新書終於出版了！！
《 擁有過 就好 》已經上架「誠品書店」

* 我的首頁也有放「誠品蝦皮」購書連結！

實體書店裡，我寫的書，我都有要求「不要封膜」
因為希望沒有預算的讀者，也能有機會閱讀！
歡迎各位去書店翻一翻😊

(^o^)

作者 #黃山料  新書 《 #擁有過就好 》

【 線上通路 】

台灣讀者👉  去「誠品蝦皮」，1本就能免運費
馬來西亞 讀者👉 「大眾蝦皮」或「大眾官網」皆可買
其他國家👉 「博客來網路書店」可跨國寄送",94.67,"{'0': '942539328200274', '1': '1405375394659153'}",2025-11-30 20:32:00+08:00,2025-12-02 23:52:07+08:00,DRrjrUQiScz,Yes,Instaloader
2025-12-07 12:32:29+00:00,2025-12-10 06:13:23+00:00,黃山料,iam_3636,884508027671398,884508027671398,64,5396.0,183982.0,"#停止情緒的消耗
 
如果你已經很努力了，卻無力改變。
與其內耗，不如接受自己的無能為力，
讓情緒的消耗停止，停損。
 
通常，我們遇到的事情，
事情本身沒有情緒，但會被我們賦予情緒。
 
如果我們認為一件事是痛苦與消耗，
那麼，我們就會被消耗；
 
但如果能輕鬆的看待，
#事情就會變得很小。
 
視角改變了，事情也就變了。
 
我的新書《擁有過 就好》書裡寫說，
卡住你的不是他，而是你轉不過來的念頭。
想法變了，情緒就變，
情緒變了，局面可能也因此改變。
 
你想想，
許多人遇事、卻事不關己，他們煩惱特別少，
但，把什麼事都看得很重的人，煩惱特別多。
 
那我們可以學習把遇見的波折看淡，
只要你覺得那不是什麼大事，就等於沒事。
 
#你可能會覺得這是自欺欺人，
但說真的，很有用。
 
因為事情的大小，往往取決於一個人的認知，
盡力了卻無法改變，那就改變自己的認知。
 
去改變那些自己能改變的，
接受自己無法改變的，
並且不讓那些無法改變的事情繼續侵蝕心靈。
 
等事過境遷，會迎來轉機，
又或許，那個轉機就是
——— 當時間過去，一切早已經不重要了。
 
 
 
 
作者 #黃山料 《 #擁有過就好 》",83.41,{'0': '1405375394659153'},2025-12-07 20:32:29+08:00,2025-12-10 14:13:23+08:00,DR9lsdGCQ0P,Yes,Instaloader
2025-12-14 11:52:02+00:00,2025-12-17 01:42:09+00:00,黃山料,iam_3636,886902163933185,886902163933185,52,3828.0,87551.0,"為什麼「不能輕易提分手」👇👇👇
 
1.
提過分手的感情
即使因為對方挽留了，而選擇繼續在一起
但感情也已經產生了裂痕。
再怎麼彌補，都回不到以前的樣子了
 
2.
被你丟下過一次的人，
就會無時無刻的戰戰兢兢，
害怕再次被丟下
 
3.
其實很多小爭執，不需要上升到分手，
用智慧可以化解，說開來就沒事。
如果總是把小缺點放大，
有矛盾就想著先分開算了，
最後只會真的分手。
 
4.
分享《擁有過 就好》書裡一段話：
 
其實兩個人「會不會在一起」
只取決於兩個人「想不想在一起」
一旦有分手作為選項（退路）
感情只會一直不安定、遲早真的分開。
 
5.
【總結】
值得分手的唯一理由，
就是你不愛我了，或是我不愛你了
沒有發生這兩個情況，
就請緊緊抓著，不要放。
 
 
作者 #黃山料 新書《 #擁有過就好 》",50.11,{'0': '1405375394659153'},2025-12-14 19:52:02+08:00,2025-12-17 09:42:09+08:00,DSPikPwiaYi,Yes,Instaloader
2025-12-21 14:18:14+00:00,2025-12-27 15:39:30+00:00,黃山料,iam_3636,864576446409097,864576446409097,88,9373.0,271546.0,"《餘生是你 晚點沒關係》書裡寫說———
 
想要健康的愛情，
先去健康的環境、成為健康的人。
因為相同特質的人，會互相吸引。
 
獨自一個人跨年，其實也好。
與其在人群裡，用喧囂掩蓋寂寞，
不如靜下來，調整好自己的狀態，
 
先把一個人的日子過明白了，
你才會漸漸明白，
你適合跟怎樣的另一個人一起過日子。
 
《 好好生活 慢慢相遇 》書裡寫說———
 
在對的時間，遇到對的人，真的很重要，
如果在重要的日子，沒有對的人，
那我寧可一個人，不將就，
我不會為了掩蓋寂寞，而往人堆裡蹭。
 
有時候，
單身，並無欲無求的人，
才是最幸福的。
 
因為你不再遷就於誰的情緒，
不必再受委屈。
 
單身的時候，
你的所有溫柔，所有的耐心，
所有的愛都完整留給了自己。
 
如果你剛好沒有對象，
不如一個人靜下來，回顧過往一年的成果，
想想新的一年，如何展望、設定新的目標。
 
最後想分享
《把日子 慢慢變好》書裡的一段話 ———
一輩子能陪你最久的，
從來不會是「你喜歡的人」，而是「你喜歡的事」
 
所以，單身是你最好的「自我增值期」
培養興趣、投入事業、提升自己。
 
我們永遠要提升自己，
拓展自己的圈子，去配上更好的人，
而不是降低標準，去妥協一個讓你難過的人。

作者 #黃山料",76.3,"{'0': '4108289472817671', '1': '1405375394659153'}",2025-12-21 22:18:14+08:00,2025-12-27 23:39:30+08:00,DSh08QUCayS,Yes,Instaloader
2025-12-28 13:12:02+00:00,2025-12-30 14:52:42+00:00,黃山料,iam_3636,1105777554998204,1105777554998204,136,7817.0,196620.0,"新的一年，祝福你們———
「遇見一個能交心的伴」
 
是情侶也是朋友，是知己，也是家人。
你們相處時像孩子，
遇到問題時，又能像大人般的處理。
 
他讓你懂得，最好的愛，
一定是同時成熟，並同時幼稚著，
兩個人能像大人一樣負責任，
也同時被彼此，寵到像孩子一樣，單純快樂著。
 
作者 #黃山料
《 #把日子慢慢變好 》
《 #擁有過就好 》",69.52,"{'0': '4108289472817671', '1': '1405375394659153'}",2025-12-28 21:12:02+08:00,2025-12-30 22:52:42+08:00,DSzu8j5CenH,Yes,Instaloader
