creation_time,modified_time,post_owner.name,post_owner.username,id,media_id,statistics.comment_count,statistics.like_count,statistics.views,text,duration,tags,creation_time_tw,modified_time_tw,short_code,is_file_exist,DownloadTool
2025-08-30 14:10:00+00:00,2025-09-01 04:20:08+00:00,日本失心瘋俱樂部,japanuts,2420983325008888,2420983325008888,47,621.0,92052.0,"這趟 #金澤之旅 我先推這間飯店！
就在#近江町市場 對面，走路3分鐘抵達
check in後可以直奔去吃海鮮🤩
離金澤車站及各個觀光景點都不遠
車站旁還有FORUS百貨能逛逛
周邊機能完善，便利性很高👍🏻

這間是📍金澤 FORZA 飯店（Hotel Forza Kanazawa）
地址：石川縣金澤市安江町2-10 
（JR「金澤站」步行約10分鐘）

我們一家入住了角落雙床房
裡面的沙發可以變成沙發床
因為是邊間房，空間也較為寬敞
讓我驚豔的是房內竟然有 #LG電子衣櫥 ！
還有一台腿部按摩機！！🥹✨
除此之外也有浴缸能夠泡澡
對於在外走整天的人來說簡直是一大福音

房內附了代幣可以去投飲料販賣機
茶包則是石川縣知名的  #加賀棒茶 
飯店早餐也使用了很多當地的食材喔👏🏻
整體入住體驗很不錯
有會說中文的服務人員，友善且親切
之後要到金澤旅遊的話可以來住這間！

留言+1，索取樂天旅遊最新優惠資訊💕

看更多日本飯店開箱 ►追蹤 @japanuts

 #金澤旅遊 #金澤住宿 #石川 #FORZA #Kanazawa #近江町市場 #日本旅遊 #日本自由行 #飯店開箱 #樂天旅遊 #失心瘋日本飯店 #瑤編",38.08,,2025-08-30 22:10:00+08:00,2025-09-01 12:20:08+08:00,DN-2URFCcKJ,Yes,Instaloader
2025-09-01 14:22:19+00:00,2025-12-11 03:47:15+00:00,日本失心瘋俱樂部,japanuts,938474841883604,938474841883604,47,513.0,78272.0,"快傳給你的哆啦A夢控朋友～💙
＃FANCL 跟＃哆啦A夢 聯名的
「日本限定包裝」真的太犯規了！

聯名商品除了影片中開箱的
洗顏粉及卸妝油還有泥狀洗面乳喔
整組洗卸用品都好欠買😍
連洗臉都可以享受開盲盒的快樂
誰能抗拒得了啦～～💓

現在在日本FANCL專櫃、網路商店、部分藥妝店就買得到了
數量有限喔！要買的朋友們快衝～
想看更多日本旅遊資訊► @japanuts

@fancl_official
＃哆啦A夢 #FANCL＃#ドラえもん #cosme失心瘋 ＃開架保養 ＃日本藥妝店 ＃日本卸妝 ＃日本洗面乳  #日本美妝 #日本限定 #恩編",32.02,,2025-09-01 22:22:19+08:00,2025-12-11 11:47:15+08:00,DOEBNdfiZvD,Yes,Instaloader
2025-09-03 14:35:00+00:00,2025-12-03 16:09:22+00:00,日本失心瘋俱樂部,japanuts,25489255764104180,25489255764104182,335,2453.0,134341.0,"在飛驒高山住到一間質感滿滿的飯店！
交通也方便，從高山站走路大概4分鐘就能到
對我這種拖著行李
只想趕快 check-in 的人來說，真的大大加分😆

* ⁎ ⁎ * ⁎ ⁎ * ⁎ ⁎ * ⁎ ⁎ * ⁎ ⁎
這間是👉🏻📍hotel around TAKAYAMA, Ascend Hotel Collection
* ⁎ ⁎ * ⁎ ⁎ * ⁎ ⁎ * ⁎ ⁎ * ⁎ ⁎
⠀
它房間空間超寬敞，我住的這間竟然還有小客廳！
木質傢俱＋暖色調燈光，一走進門就覺得很放鬆
住起來更是舒服到不行
行李箱可以直接打平放好幾個、置物空間也超夠
跟家人一起入住完全OK，不會擠在一起！
⠀
還有一點我很喜歡的是
這間飯店設有行政酒廊（lounge）
可以進去喝免費飲料、吃點小點心休息一下
有些房型還直接附 lounge 權限，很貼心☕
不得不說，飯店地理位置相當優秀
走路就能到飛驒高山老街跟宮川朝市
一早去吃飛驒牛壽司、飛驒牛包子
再慢慢散步回飯店剛剛好！

⚠️留言+1，領取樂天旅遊訂房優惠！

如果你最近也在計畫去高山旅遊
這間趕緊收藏起來☺️
想看更多日本旅遊資訊► @japanuts

@around_takayama
#日本旅遊 #飛驒高山 #岐阜旅行 #高山住宿推薦 #高山飯店 #飛驒高山住宿 #日本飯店開箱 #高山站住宿 #宮川朝市 #飛驒牛壽司 #飛驒牛包子 #高山老街",41.63,,2025-09-03 22:35:00+08:00,2025-12-04 00:09:22+08:00,DOJMP7aCRUr,Yes,Instaloader
2025-09-05 14:42:28+00:00,2025-09-06 16:02:33+00:00,日本失心瘋俱樂部,japanuts,1640471213619900,1640471213619900,25,834.0,83758.0,"超級可愛的狗狗布丁🍮
這家前兩天發在限動被問翻了
今天馬上來分享☺️

這家咖啡廳在 #蔵前 
店名：marble 
@marble_kuramae 
他們的布丁每天11:00才開賣唷
狗狗餅乾跟布丁是分開販售的
可以自己買來組合搭配
真的超可愛❤️
布丁口感紮實、蛋香濃郁
也很值得一吃唷！

#日本旅遊 #food失心瘋 #travel失心瘋 #日本自由行 #東京 #蔵前 #蔵前カフェ #プリン #いぬ #犬 #スイーツ部 #スイーツ #布丁",10.38,{'0': '26174823205467489'},2025-09-05 22:42:28+08:00,2025-09-07 00:02:33+08:00,DOOWqsfidCv,Yes,Instaloader
2025-09-08 15:10:04+00:00,2025-09-09 19:10:51+00:00,日本失心瘋俱樂部,japanuts,1576855710308484,1576855710308484,80,1769.0,177694.0,"絕對要被放進日本必買伴手禮清單裡！
這盒鐵盒餅乾真的美到不行，味道也好讚😍
喜歡特色伴手禮的人，來逛這品牌一定會瘋掉！
#銀之森法式甜點（PÂTISSERIE GIN NO MORI）
整個品牌都是以「森林」為主題
連店面都像走進一座森林🌲
而餅乾呢，據說是由森林裡的兩位松鼠西點師親手製作的🐿️
從外盒到內容物，每個細節都像是童話裡跑出來的
真的太犯規了！！！

我這次是在「GRAND FRONT 大阪店」入手的
看到鐵盒的那一刻忍不住直接尖叫！
打開內容物又再尖叫一次🤣
鐵盒本身質感超好，一拿出來就很有面子
送人絕對被誇爆👏

經典鐵盒「森之恩惠餅乾（Petits Bois 150）」
你們真的可以無腦收💗
它分成3個尺寸，我是買中型的150款
裡面餅乾種類超級豐富，一共有14款
造型、口味多到眼花撩亂，味道也相當不錯
有幾款還加入了橡果粉、山椒、山楂等少見食材
吃起來很特別但完全不違和，甚至讓我很驚艷！
真的有認真在研發口味！大推！
它各尺寸內容物不太一樣
有興趣的朋友可以上他們官網看看

另一個很必買的是「直營店限定鐵盒」！
銀之森在各個門市都有推出限定款式
不只外盒設計不同，連裡面的餅乾組合也都有特別搭配
完全是餅乾控會失控的那種！
我這次買到的就是超有活力的亮黃色鐵盒，可愛到不行💛
裡面餅乾也相當不錯
我打算之後去其他門市也要收集不同的紀念罐
(對了，東京車站也能買到喔！去東京的朋友記得去看看)

除了餅乾之外，他們家也有特調的茶包
在家試吃餅乾時我順便泡了洋甘菊來喝
茶包內可以看到整朵花草，用料很實在！
香氣舒服，喝完直接放鬆到快睡著😴

／入手清單／
◼︎品牌經典鐵盒（ 150 尺寸）
◼︎大阪限定黃色鐵盒餅乾
◼︎洋甘菊茶包

趕快分享給喜歡買鐵盒餅乾的朋友！
想看更多日本旅遊資訊► @japanuts

#PR #銀の森 #鐵盒餅乾 #日本伴手禮 #伴手禮 #大阪伴手禮 #大阪景點 #大阪購物 #銀之森 #奶油餅乾 #food失心瘋",70.7,,2025-09-08 23:10:04+08:00,2025-09-10 03:10:51+08:00,DOWILYkicCv,Yes,Instaloader
2025-09-10 14:10:00+00:00,2025-09-12 05:50:06+00:00,日本失心瘋俱樂部,japanuts,1871880577547561,1871880577547561,101,625.0,93374.0,"到 #大阪 住這邊真的神方便！
堺站西口空橋直通，出站走幾步路就到飯店
搭南海電鐵Rapi:t β到關西幾場只要25分鐘✨
想早點到機場或是搭早班機的人
這裡是一個很不錯的中間點！
而且對面就是大型百貨 #PLATPLAT 
裡面有很多好逛的店鋪
像是無印良品、cocokarafine、AEON超市KOHYO等
斜對角還有一間大間的LIFE超市！
隨時都能小買一下👍🏻
想到難波逛，只要再搭一站～超級近！
堺站東口也有能直達大阪世博會的巴士喔🤩

這間是
📍大阪堺Agora Regency飯店
（Hotel Agora Regency Osaka Sakai）
地址：大阪府堺市堺區戎島町4-45-1

一走進去就看到非常氣派的大廳
我這次住在24樓，房間很大！
地板空間大到開3個行李箱都沒問題🤣
窗外就可以看到車站及PLATPLAT百貨
早上拉開窗簾的採光很好
我晚上睡覺也沒有被外面的聲音影響到
房內設備狀態都保持很好，整體也乾乾淨淨～
早餐是自助式，麵包選擇很多
還可以自己組合炒麵麵包呦😆

要到大阪玩的朋友可以參考看看！
底下隨意留言～我傳訂房連結給你呦✨
@hotel_agora_regency_osakasakai

想看更多日本飯店開箱►追蹤 @japanuts

 #大阪旅遊 #大阪住宿 #堺站 #AgoraRegency #大阪堺AgoraRegency飯店 #關西機場 #日本旅遊 #日本自由行 #飯店開箱  #失心瘋日本飯店 #瑤編",35.04,,2025-09-10 22:10:00+08:00,2025-09-12 13:50:06+08:00,DObLGgqkWJH,Yes,Instaloader
2025-09-11 14:05:00+00:00,2025-09-13 15:05:09+00:00,日本失心瘋俱樂部,japanuts,1958310175123803,1958310175123803,74,328.0,82829.0,"超讚的高樓層景觀 #鐵板燒餐廳 ！
我這趟去大阪選擇住在「大阪堺Agora Regency飯店」
它與堺站西口直通，到機場只需要25分鐘
地點真的超方便～✨
入住前滑他們的官網發現
今年8/1開了一間新的鐵板燒餐廳
位在飯店的25樓！
裡面有整片玻璃窗，邊吃可以邊欣賞風景
而且9/30前開幕紀念限定套餐含服務費只要¥6,000🤩
馬上決定入住當晚去吃看看！

這間餐廳叫「 #鐵板燒 Naniwa 」
主打日本傳統料理結合法式精緻烹調手法
我是晚餐時段去吃
點了 #暁 （AKATSUKI）這個開幕限定套餐
從前菜、湯品到甜點總共有6道菜
每一道都很不錯
其中我最難忘的是第一道「 #大阪梅牛鐵板壽喜燒 」
師傅放上一塊棉花糖，再淋上特製醬汁
那個香味馬上竄出來🤤
大阪梅牛很嫩很好吃，我一下就掃空了！

吃一吃窗外的天色也漸漸變暗
看著大阪的夜景，以及師傅精彩的鐵板秀
配上美食，根本是眼睛與味蕾雙重享受💓
整個用餐體驗蠻好的，我覺得CP值不錯
去大阪玩想吃鐵板燒的朋友可以參考看看😉

🍽有興趣的朋友在底下留言，我私訊訂位連結給你呦！

｜鐵板燒 Naniwa｜
午餐：11:30–15:00（最後點餐 14:30）
晚餐：17:30–21:30（最後點餐 20:30）
地址：大阪府堺市堺區戎島町4-45-1 25F
（大阪堺Agora Regency飯店內）
@hotel_agora_regency_osakasakai

想看更多日本美食►追蹤 @japanuts

 #大阪旅遊 #大阪美食 #堺站 #AgoraRegency #鐵板燒 #Naniwa #日本旅遊 #日本自由行 #大阪必吃 #food失心瘋 #瑤編",33.51,,2025-09-11 22:05:00+08:00,2025-09-13 23:05:09+08:00,DOdvTEQkdhx,Yes,Instaloader
2025-09-12 04:47:29+00:00,2025-09-14 05:47:37+00:00,日本失心瘋俱樂部,japanuts,1487313339848306,1487313339848306,78,344.0,82978.0,"韓牛怎麼這麼好吃！！！
一開始想說，吃起來應該跟和牛差不多吧
沒想到，吃起來的感覺很不同，各有特色
韓牛一入口就超軟嫩，但不太油，所以不膩口
有一種會忍不住想一直吃下去的感覺，好讚

這是我第一次吃韓牛
選了這間在江南站附近巷子裡的餐廳
「一片里脊江南店（일편등심 강남점）」<redacted_mention>
剛好離我這次住的飯店很近，吃飽就能散步回去

我們一家三人，選了看起來很厲害的VIP套餐
除了包含4種部位的韓牛，還有附一份大醬湯飯
說真的，這個量我們兩大一小吃得很飽耶
全程都有專業的歐巴幫忙烤肉，真的超讚
不用自己一邊忙著烤又要一邊吃，專心享受就好
而且專業的來烤就是不一樣，真的就是比較好吃
真的很推薦大家來首爾一定要吃吃看韓牛

韓牛吃起來雖然不像和牛會有入口即化感
但口感軟嫩又保持多汁，吃起來也不油膩
完全是另一種感覺的美味，非常好吃啊～

建議提前用Catch Table預約
留言＋1 索取預約網址

▪︎▪︎▪︎▪︎▪︎▪︎▪︎▪︎▪︎▪︎▪︎▪︎▪︎▪︎▪︎▪︎▪︎▪︎▪︎▪︎▪︎▪︎▪︎▪︎▪︎▪︎▪︎▪︎▪︎
一片里脊江南店（illpyeon Sirloin）
20 Teheran-ro 1-gil, Gangnam District, Seoul
營業時間 11：00～23：00 
▪︎▪︎▪︎▪︎▪︎▪︎▪︎▪︎▪︎▪︎▪︎▪︎▪︎▪︎▪︎▪︎▪︎▪︎▪︎▪︎▪︎▪︎▪︎▪︎▪︎▪︎▪︎▪︎▪︎

＿＿＿＿＿＿＿＿＿＿＿＿＿＿＿＿＿＿＿

韓牛ってなんでこんなに美味しいの！？🤩
 最初は「和牛と同じような感じかな？」と思っていたけど、実際に食べてみると全然違っていて、それぞれに特徴があるんです✨
韓牛は口に入れた瞬間とても柔らかいのに、脂っこすぎずサッパリしていて、ついつい食べ続けたくなる美味しさ！最高でした💯
今回初めて韓牛を食べたのですが、選んだお店は江南駅近くの路地にある
 「일편등심 강남점（一片里脊 江南店）<redacted_mention>」
 宿泊していたホテルからも近くて、食後に散歩しながら帰れるのも良かったです🚶‍♀️
家族3人で見た目から豪華なVIPセットを注文🍴
 韓牛4種類の部位に加えて、テンジャンチゲご飯も付いていて、2大人＋1子供でお腹いっぱいになれました！
しかも終始プロのオッパが焼いてくれて、こちらは食べることに専念できるんです🔥
 やっぱりプロに焼いてもらうと味が違う！より一層美味しかったです。
 ソウルに来たら韓牛は絶対に食べてほしいと心から思いました🥩✨
和牛のような「とろける感じ」ではないけれど、柔らかくジューシーで、脂っこくない。
 全く別の魅力を持った美味しさで、本当に感動しました！
👉 来店の際は Catch Table での事前予約がおすすめです！

▪︎▪︎▪︎▪︎▪︎▪︎▪︎▪︎▪︎▪︎▪︎▪︎▪︎▪︎▪︎▪︎▪︎▪︎▪︎▪︎▪︎▪︎▪︎▪︎▪︎▪︎▪︎▪︎▪︎
 📍 일편등심 강남점（Ilpyeon Sirloin）
 서울 강남구 테헤란로1길 20
 営業時間 11:00～23:00
▪︎▪︎▪︎▪︎▪︎▪︎▪︎▪︎▪︎▪︎▪︎▪︎▪︎▪︎▪︎▪︎▪︎▪︎▪︎▪︎▪︎▪︎▪︎▪︎▪︎▪︎▪︎▪︎▪︎

＿＿＿＿＿＿＿＿＿＿＿＿＿＿＿＿＿＿＿

#韓國 #korea #Seoul #일편등심강남점 #일편등심 #강남점 #먹스타그램 #맛집 #food #seoulfood #koreafood #한우고기 #韓牛 #illpyeonSirloin",37.99,"{'0': 'non_public_1595796465434832', '1': 'non_public_1266040158744755'}",2025-09-12 12:47:29+08:00,2025-09-14 13:47:37+08:00,DOfTBdeiREn,Yes,Instaloader
2025-09-12 14:05:58+00:00,2025-09-14 04:36:29+00:00,日本失心瘋俱樂部,japanuts,1936042310323538,1936042310323538,118,865.0,122491.0,"來分享我一直在用的「夏日續命組」
最近不管在台灣還是日本都熱到崩潰🥵
底妝沒撐多久就開始出油、浮粉
毛孔明顯、痘痘也來湊熱鬧，這天氣真的沒在放過人...
影片中都是我實測有感的好物
從妝前、定妝到保養通通有
有在為夏天煩惱的，趕快先收藏起來！

其中 CLEARTURN 這兩款面膜我超愛！
#粉色款 專門針對敏感、泛紅問題設計
裡面是高濃度修護型精華，用起來非常溫和
泛紅肌膚敷完穩定很多，當急救也很夠力！
#黃色款 則是為了痘痘、油肌調理
植萃成分搭配清爽涼感，敷上去立刻有鎮定的舒緩感
生理期前後、膚況容易爆炸的時候敷，皮膚會安分一些

這兩款面膜紙也非常優秀
是經過「凹凸壓紋高密著處理」的設計
貼合度高，不會一邊敷一邊滑來滑去
重點是還能順便代謝角質，很貼心！

◼︎美顏定格持粧噴霧PLUS(沁檸薄荷)：噴上立刻鎖妝＋降溫，底妝服貼一整天
◼︎美顏定格吸油蜜粉紙：吸油＋補妝一張搞定，小包裝外出攜帶超方便
◼︎CLEARTURN 速攻集中安心面膜：泛紅、敏感、曬後況失控時緊急救援！敏感肌也能安心用
◼︎CLEARTURN 集中調理禦痘面膜：針對痘肌設計，涼感植萃配方，生理期膚況糟的時候敷很剛好！
.
.
.
／／／🎁 抽獎活動／／／
｜抽獎步驟｜
①追蹤 @japanuts 
②分享此貼文到限時動態
③留言區Tag 1位朋友，並留言告訴我「你最近的肌膚困擾」
​
｜獎品｜
【CLEARTURN 速攻集中安心面膜*1】
或【CLEARTURN 集中調理禦痘面膜*1】
共抽出4位得獎者（款式隨機）
​
｜活動時間｜
活動日期：即日起～9/21 12:00
開獎時間： 9/22 於留言區公佈得獎者
​
⚠️大家記得確實完成上面步驟，若有遺漏會被取消抽獎資格呦！
⚠️日本失心瘋保有活動最終解釋權力
⚠️獎品寄送僅限台灣地區
⚠️請勿複製別人的答案
快分享給身邊的油肌朋友！

想看更多日本旅遊資訊► @japanuts

#夏日保養 #高絲KOSE #敏感肌面膜 #定妝噴霧推薦 #禦痘面膜 #吸油蜜粉紙 #UruminaPlus #妝容持久術 #妝前妝後神隊友avel/spring #cosme失心瘋 #PR",40.52,,2025-09-12 22:05:58+08:00,2025-09-14 12:36:29+08:00,DOgUE0KCade,Yes,Instaloader
2025-09-13 15:30:23+00:00,2025-09-14 10:20:28+00:00,日本失心瘋俱樂部,japanuts,892413606974672,892413606974672,23,753.0,108367.0,"在高山老街吃過這麼多次，飛驒牛料理我最愛這間！
主打A5等級飛驒牛以及創意壽司
店內每一道真的都超有誠意
最人氣的「飛驒牛三吃」(飛騨牛ひつまぶし)
一碗就可以吃出三種層次💗
首先，先吃原味感受牛肉和醋飯的絕妙平衡
第二吃換搭配特製佐料一起入口
最後還能加上熱鰹魚高湯，變成茶泡飯！
每一口都很讓人驚艷🙌🏻
完全不用擔心份量太多會吃膩🤤

「飛驒牛沙朗牛排蓋飯」也是好吃的很誇張！
熟度掌握得剛剛好，肉質軟嫩到入口即化
一吃就停不下來啊！
對了，別忘了點招牌的「飛驒牛握壽司拼盤」喔
裡面包含四貫握壽司跟飛驒牛鐵火卷
牛肉油香在嘴裡化開，吃完真的會想念很久🤣

這家我已經默默回訪很多次了
每次來都還是覺得好好吃
有要去高山老街的朋友，拜託一定要收藏起來！

📍創作鄉土壽司本舖 梗絲 Kyoushi
 地址：岐阜県高山市本町2-82
 ※座位數不多，建議早點來或平日前往

想看更多日本旅遊資訊► @japanuts

@kyou.shi
#高山老街 #飛驒牛 #飛驒牛壽司 #飛驒牛三吃 #高山美食 #高山老街美食 #岐阜美食 #岐阜自由行 #岐阜景點 #岐阜美食 #高山グルメ #飛騨高山 #food失心瘋 #travel失心瘋 #B編",19.74,,2025-09-13 23:30:23+08:00,2025-09-14 18:20:28+08:00,DOjCc93iVtO,Yes,Instaloader
2025-09-14 15:04:14+00:00,2025-09-15 05:24:19+00:00,日本失心瘋俱樂部,japanuts,1240946394141876,1240946394141876,43,3093.0,159692.0,"來去上高地住一晚❤️

這間飯店真的美呆了
躺在床上就可以欣賞景色，超級讚
去年第一次來上高地我就看中這間
完全是美景第一排，沒有任何遮蔽物
想說如果下次再來，好想來這裡住一晚

今年年初一安排要再去一次上高地
我就想說要盯緊飯店開放訂房的時間
但因為上高地每年開山時間有限
加上當地飯店不多、遊客又很多
所以房間都超級難訂，一開放就要手刀搶
還好提前很多計劃，所以飯店官網一開放
我就衝進去訂房成功了！超級開心～

我們訂了三人房，兩天一夜含早晚餐
飯店費用不便宜，但擁有這樣的美景一整天
還是覺得很滿足！（想知道的再私訊我）

當天Check-in，遇到一名會中文的日本員工
態度非常親切、介紹的很好，很感謝他
我們訂到的房型是和洋室
塌塌米地板＋兩張床＋一張沙發床
整體空間不算大，但床鋪滿大一張的
睡起來很舒服，窗戶也很大一面，採光超好
重點是，躺在床上就可以欣賞美景，超讚
不用在外面人擠人，還可以吹冷氣唷

當天的晚餐是法式料理
前菜、湯、魚、肉，每一道都很讚
隔天一早的早餐也很棒，還可以在露台享用
一邊欣賞清晨的上高地美景，一邊吃早餐
有計劃想去上高地住一晚的可以參考這間

＿＿＿＿＿＿＿＿＿＿＿＿＿＿＿＿＿
上高地白樺莊
電話：0263-95-2131
〒390-1516 長野県松本市安曇上高地
＿＿＿＿＿＿＿＿＿＿＿＿＿＿＿＿＿
@kamikochi_official 
@shirakabaso_kamikochi
#長野 #上高地 #白樺莊 #上高地白樺莊 #nagano #kamikochi #かみこうち #飛驒 #河童橋 #穗高岳 #松本 #matsumoto #HotelShirakabaSo #上高地ホテル白樺荘 #ホテル白樺荘",25.59,,2025-09-14 23:04:14+08:00,2025-09-15 13:24:19+08:00,DOlkIgFCZqx,Yes,Instaloader
2025-09-16 13:59:57+00:00,2025-09-19 11:00:27+00:00,日本失心瘋俱樂部,japanuts,1242969697260491,1242969697260491,197,1253.0,140766.0,"走路3分鐘就到JR京都站的高質感住宿！
距離京都站八条口超近，拖行李過來也完全沒壓力
飯店整體走木質質感風
房間乾淨又整潔，空間也很夠用
 還貼心附上桌上型化妝鏡和充電線，細節滿滿！

1樓迎賓 Bar 提供超多免費小點心跟飲料
還有清酒、紅酒等酒類，非常加分😍
我覺得這間住起來相當舒服
CP值很高，分享給你們👏

📍REF VESSEL HOTELS 京都八条口
地址：日本京都府京都市南區東九條室町57番地
(JR京都站八条口走路3分鐘)

想看更多日本旅遊資訊► @japanuts

※未成年請勿飲酒，酒後不開車
#travel失心瘋 #日本飯店失心瘋 #京都住宿 #日本自由行 #refvesselhotels #京都車站飯店 #行李運送服務 #京都飯店推薦 #京都旅遊 #京都觀光 #京都 #B編",31.56,,2025-09-16 21:59:57+08:00,2025-09-19 19:00:27+08:00,DOqmk6VCUW8,Yes,Instaloader
2025-09-17 14:06:46+00:00,2025-09-19 05:56:57+00:00,日本失心瘋俱樂部,japanuts,924088250156677,924088250156677,8,440.0,88725.0,"在 #福井 發現了一間超有特色的麵包店！
他們家的 #明太子法國麵包 我到現在還是念念不忘
麵團很香有嚼勁，搭配上明太子奶油
真的好吃到不行🥹
而且裡面加了竹碳，黑溜溜的很特別！
 #可頌 是他們的人氣第一名，也很美味🥐

我一開始是被它的建築外觀給吸引
是個漂亮的石造圓形建築
很像童話故事中會出現的房屋
查了一下發現是 #隈研吾 監製
上面還有他的簽名呦😍

麵包店位在複合式觀光設施 #ESHIKOTO 前方
由「黒龍酒造」共同經營
ESHIKOTO有進駐餐廳也有酒品販售店
想買黒龍酒造的清酒，外帶完麵包可以去逛逛～
這邊距離知名景點永平寺開車15分鐘
地點比較偏，自駕會比較方便
計畫要自駕玩福井的朋友
這間麵包店一定要加入必訪清單！

📍HAREYA（ハレヤ）
地址：福井縣吉田郡永平寺町下浄法寺12-8
営業時間:9:00-17:00（星期三公休）
@hareya_bakery 

 #福井旅遊 #福井必吃 #福井旅遊 #福井麵包店 #hareya #ハレヤ #日本旅遊 #日本自由行 #travel失心瘋 #food失心瘋 #瑤編",16.81,,2025-09-17 22:06:46+08:00,2025-09-19 13:56:57+08:00,DOtMKC5idLp,Yes,Instaloader
2025-09-18 14:04:42+00:00,2025-09-19 05:45:16+00:00,日本失心瘋俱樂部,japanuts,1697747021602114,1697747021602114,502,2105.0,286264.0,"精選！大阪難波一日遊必去懶人包！
落地關西機場就能直接照著走的超順行程🔥
搭南海電鐵直達難波，一下車就是百貨密集戰區
第一餐先去朝聖收藏很久的牡蠣拉麵名店🍜
接著一路逛百貨、藥妝、地下街
逛到打烊最後一刻才回飯店！好滿足啊

💌 難波必逛清單我整理出來囉！想要的朋友留言跟我說

初訪大阪的朋友，這兩件事一定要知道：
①. 現在關西多條地鐵路線都可以直接刷 Visa 進出站
不只實體信用卡，連手機（Apple Pay、Android）也能感應進站

②. 善用 TableCheck (訂位網站) 訂餐廳
行前訂好位就不用浪費時間到現場排隊了！
使用 Visa 還可以在東京、京都、大阪
最多40間餐廳享9折優惠！

❀ — ❀ ——— ❀ — ❀ ——— ❀ — ❀ ——
【 Visa 日本優惠懶人包 🇯🇵】
🔍 日本優惠總覽：https://lihi1.com/HmDIC

◼︎TableCheck
預訂東京、京阪40間精選餐廳，享 Dine with Visa 優惠9折 (2025/12/31前)

◼︎Agoda
刷Visa訂房，最高享7%優惠 (2025/12/31前)

◼︎Trip.com
機票、飯店折扣高達$3,400，商務卡再享樂園門票買1送1 (2025/9/30前)

◼︎ Expedia 
刷 Visa 並輸入優惠碼「VISAYRO」，享8%優惠 (2025/12/31前)

❀ — ❀ ——— ❀ — ❀ ——— ❀ — ❀ ——

想看更多日本旅遊資訊► @japanuts

#購物刷Visa #Visa挺你玩遍世界 #日本旅遊 #難波 #大阪自由行 #大阪 #難波購物 #難波自由行 #難波美食 #大阪拉麵 #關西機場 #南海電鐵 #大阪美食 #牡蠣拉麵 #大阪美食推薦 #大阪百貨 #B編",46.81,,2025-09-18 22:04:42+08:00,2025-09-19 13:45:16+08:00,DOvwrpsiZ9f,Yes,Instaloader
