creation_time,modified_time,post_owner.name,post_owner.username,id,media_id,statistics.comment_count,statistics.like_count,statistics.views,text,duration,tags,creation_time_tw,modified_time_tw,short_code,is_file_exist,DownloadTool
2025-01-01 10:37:19+00:00,2025-02-14 03:53:49+00:00,日本失心瘋俱樂部,japanuts,1979191319301160,1979191319301160,12,1253.0,256118.0,"這太酷了😃
現在Google搜尋🔍 #魷魚遊戲 
就可以線上玩 #一二三木頭人 
各語言輸入都可以喔，大家快去玩玩看

#SquidGame #오징어게임 #google #netflix #googlegame #イカゲーム #グーグル",15.67,,2025-01-01 18:37:19+08:00,2025-02-14 11:53:49+08:00,DER5idQpwy3,Yes,Instaloader
2025-01-01 14:42:37+00:00,2025-02-14 03:53:49+00:00,日本失心瘋俱樂部,japanuts,25684821857867040,25684821857867040,86,4361.0,771554.0,"觀察日本人的習慣
好像真的就是這樣耶
你們看到的也是嗎？",22.17,,2025-01-01 22:42:37+08:00,2025-02-14 11:53:49+08:00,DESWIgfz-cH,Yes,Instaloader
2025-01-02 14:16:22+00:00,2025-02-14 03:53:49+00:00,日本失心瘋俱樂部,japanuts,1442991390636090,1442991390636090,16,2362.0,330427.0,"第4款請閉眼入！超級好吃🤤
回國前在羽田機場最後血拼
不知道該買什麼伴手禮回來送人的話
快把這篇收藏起來！！！

馬上傳給要去東京的朋友❤️
想看更多日本旅遊資訊► @japanuts

@kamakuragoro_jp @nycsand_official 
@tokyo_lemonche_official @hatada_official
#food失心瘋 #羽田機場 #東京伴手禮 #日本伴手禮推薦 #日本伴手禮 #羽田空港 #日本購物 #東京自由行 #B編",40.61,,2025-01-02 22:16:22+08:00,2025-02-14 11:53:49+08:00,DEU4IfMzwUb,Yes,Instaloader
2025-01-03 14:19:38+00:00,2025-07-06 04:07:24+00:00,日本失心瘋俱樂部,japanuts,1492423525649783,1492423525649783,17,3910.0,451483.0,"湯咖哩大好き 
去北海道一定要吃湯咖哩

說實話，以前我不懂湯咖哩的美味
總覺得咖哩就是要吃濃濃稠稠的才對
所以對於北海道的湯咖哩一直沒有感覺
直到今年在朋友推薦下第一次嚐試
才一整個掉入湯咖哩的靈魂領域無法自拔

「怎麼會這麼好吃呢？」😍
這是我第一次吃完後的唯一心得
雖然咖哩變得湯湯水水的
但卻完全不影響它的美味程度
大大打臉我認為它會淡而無味的想法
咖哩湯非常濃郁但卻不會膩口，真的很讚
裡面的蔬菜也是一絕，搭配起來好吃極了
更不用說軟嫩到一夾就化開的雞腿肉
吼～ 想到我就開始分泌口水了...

最近幾次只要有機會去札幌出差
我就把握機會跑去吃湯咖哩
目前吃到不錯的三家，推薦給你們

－．－．－．－．－．－
1. #奧芝商店 
2. #SOULSTORE (#ソウルストア) 
3. #RAMAI (#ラマイ)
－．－．－．－．－．－

👉「奧芝商店 実家 」@okushibashouten
Google：4.0顆星（744則評論）
身邊朋友最多好評的湯咖哩名店
以蝦湯底熬製咖哩聞名，湯頭帶有濃濃蝦味
不過湯底其實有三種選擇，不吃蝦的也ＯＫ
蝦湯底、雞湯底、牡蠣湯底，我愛蝦湯
奧芝商店的蝦湯湯底味道很濃郁
搭配著蔬菜和雞腿一起吃，很快會吃光光
雖然濃郁但不會覺得油膩，非常好吃
下次我要試試牡蠣湯底，再分享給你們

👉「SOUL STORE」@soulstore_official
Google：4.4顆星（775則評論）
完全採用當季盛產的北海道蔬菜
湯底是用兩種湯均勻混合而成
一是以雞肉為基礎，加入蔬果和豬肉熬製
二是以海鮮為主，加入鰹魚、昆布、蛤蜊熬煮
湯頭既清爽又有深度，口感溫和且細緻
我吃的是雞肉蔬菜咖哩，湯頭是奶白色的
喝起來是溫和的辣味，不會嗆口，很舒服
他們家的特色是都會有一根炸牛蒡，口感層次豐富

👉「RAMAI」
Google：4.4顆星（2078則評論）
這家店是我第一間吃的湯咖哩
也可以說是拜他所賜讓我愛上湯咖哩
不過，這間店很特別，店舖比餐點更吸睛
從一開始在店門口，完全不覺得是一間餐廳
走進來後更是被超濃厚的峇里島風情嚇到
不說真的會以為這是一間按摩的營業場所
餐廳內空間很大，隔成多個開放包廂的感覺
湯咖哩辣度分很多等級，我平時小辣吃到３差不多
辣度可以無限追加，聽說很多韓國人喜歡來這間
店舖本身距離車站比較遠，要走一段路才能到

#日本 #北海道 #札幌 #湯咖哩 #スープカレー #sapporo #hokkaido #札幌グルメ #サッポロ #カレー #スープカレー札幌",32.97,,2025-01-03 22:19:38+08:00,2025-07-06 12:07:24+08:00,DEXcme7TswN,Yes,Instaloader
2025-01-04 14:12:17+00:00,2025-06-15 07:48:22+00:00,日本失心瘋俱樂部,japanuts,2291608051374645,2291608051374645,1,663.0,144334.0,"乾肌快看過來！
這三款美妝品分享給你們😍
全都只有 #北海道 才買得到喔！

①登別溫泉OV9面膜
這款「黑面膜」裡含有登別地獄谷的九種泉水精華
精華液給蠻多的，保濕效果不錯！
沒有添加酒精跟香精
而且清爽不黏膩，我很喜歡💓

②白雪美精 北海道馬油保濕護唇膏
再來是來自北海道的品牌
護唇膏裡添加了 #馬油 成分
薄擦一層滋潤度就不錯！
單擦在唇上會呈現有點水亮的光澤感

③曼秀雷敦 高保濕護手霜
這條護手霜是 #北海道限定
真的超潤膚！非常適合那邊的天氣👏🏻
而且在攝氏-20度的環境下也不會結凍！
我覺得很好吸收，不會太過油膩
擦完後指緣的乾裂處非常滋潤

剛好現在冬天
如果肌膚、嘴唇較容易乾裂的人
可以參考看看這幾款商品喔！😘

 #北海道 #日本美妝 #登別溫泉面膜 #白雪美精 #馬油 #護唇膏 #曼秀雷敦 #護手霜 #瑤編",38.08,,2025-01-04 22:12:17+08:00,2025-06-15 15:48:22+08:00,DEaBRHlT7R-,Yes,Instaloader
2025-01-05 14:33:38+00:00,2025-02-14 03:53:49+00:00,日本失心瘋俱樂部,japanuts,1671550557357595,1671550557357595,22,2661.0,385239.0,"不知道會賣到什麼時候！
去日本有看到快買🤤

立刻傳給要去東京的朋友💗
想看更多日本旅遊資訊► @japanuts

@3coins_official #スリーコインズ #3coins #日本零食 #日本必買 #日本伴手禮 #日本自由行 #B編",74.07,,2025-01-05 22:33:38+08:00,2025-02-14 11:53:49+08:00,DEcodjnzzAn,Yes,Instaloader
2025-01-06 14:20:38+00:00,2025-02-14 03:53:49+00:00,日本失心瘋俱樂部,japanuts,910449531838438,910449531838438,36,2177.0,213695.0,"誰說沖繩一定要自駕才能玩的盡興！
這次自己去了一趟那霸
雖然不會開車
但還是很想到北部的景點看看🥹
尤其是 #美麗海水族館！
所以我直接報名了 KKday 沖繩北部一日遊
一整天下來覺得很是不錯🤩

我選的行程總時長約為11小時，共停4站
第一站、萬座毛
第二站、古宇利海灘
第三站、美麗海水族館
第四站、美國村

其中的重點當然就是水族館啦！
除了到本館內看鯨鯊與鬼蝠魟共游的 #黑潮之海
每日 11:30 / 13:00 / 15:00 #海豚劇場 也會有表演
非常之精彩！！
可以提早5-10分鐘去選個好位子喔✨

我覺得整體行程豐富，也不會感到匆忙
北部想踩點拍照的地方也都包含了
各點停留的時間都算是很剛好👌🏻
還有三個上下車點，可以依照個人安排做選擇
非常適合帶小孩、長輩短暫遊沖繩的家庭
或是像我一樣獨旅、不會開車的人

推薦給之後要去沖繩玩的朋友❤️
想知道更多資訊，歡迎在底下留言！
我會把相關資訊傳給你唷🥰

想看更多日本旅遊資訊►追蹤 @japanuts

 #okinawa #沖繩 #不自駕 #北部一日遊 #日本自由行 #美麗海水族館 #美國村 #古宇利島 #萬座毛 #瑤編",43.77,,2025-01-06 22:20:38+08:00,2025-02-14 11:53:49+08:00,DEfLoXITOwX,Yes,Instaloader
2025-01-07 14:01:20+00:00,2025-08-24 18:51:48+00:00,日本失心瘋俱樂部,japanuts,1391864595588664,1391864595588664,14,915.0,153339.0,"在日本也可以打包？！
最近滿多新聞報導過的
大家覺得如何呢？",26.42,,2025-01-07 22:01:20+08:00,2025-08-25 02:51:48+08:00,DEhuP1RT12B,Yes,Instaloader
2025-01-08 14:02:06+00:00,2025-08-28 05:03:03+00:00,日本失心瘋俱樂部,japanuts,2104025987020063,2104025987020063,2,659.0,117847.0,"快筆記！倉敷這間餐酒館的氣氛跟食物都好棒😍
#旧本藤邸 是由古民家改建而成的
建築物外觀跟餐廳內裝潢都很有日式風格
特別的是，裡面賣的不是日式料理，而是 #義式 喔！

我這次點的是套餐，前菜到甜點總共5道
一人份才日幣 3,500，就可以吃超級飽
他們家招牌的自家製麵，Ｑ度跟香氣都相當不錯💗
有來的話，務必要試試義大利麵🥰

對了，這邊還有提供酒水喝到飽的方案唷
用餐期間可以盡情加點酒類、軟性飲料
配餐喝非常享受！！！
我覺得很適合家族聚餐或是跟大批朋友一起來
餐廳位置就在倉敷老街附近
走路一下子就到了，推薦給你們❤️

📍古民家バル 旧本藤邸 
地址：岡山県倉敷市鶴形1-2-20

想看更多日本旅遊資訊► @japanuts

@hondoutei
#food失心瘋 #日本美食 #日本岡山 #岡山 #倉敷美食 #倉敷餐廳 #岡山餐廳 #岡山旅遊 #岡山景點 #倉敷老街 #B編",34.94,,2025-01-08 22:02:06+08:00,2025-08-28 13:03:03+08:00,DEkTSQPzt-s,Yes,Instaloader
2025-01-09 14:24:59+00:00,2025-09-20 17:53:08+00:00,日本失心瘋俱樂部,japanuts,1480874040379372,1480874040379372,13,1178.0,166906.0,"日本冬季限定巧克力又來啦!!!!!!!
這次 Ghana 超厲害...
我最推榛果口味，不藏私分享給你們🤤
它超大一顆，外層是松露巧克力
吃下去很紮實，每口都吃得到堅果❤️‍🔥
吃完一包我馬上想再來開一包啦！

快傳給愛巧克力的朋朋
想看更多日本旅遊資訊► @japanuts

#food失心瘋 #日本超商 #日本超市 #日本伴手禮 #巧克力 #冬季限定 #チョコレート #日本巧克力 #明治 #LOTTE #蛋編",54.22,,2025-01-09 22:24:59+08:00,2025-09-21 01:53:08+08:00,DEm6XL1zUvd,Yes,Instaloader
2025-01-10 14:10:10+00:00,2025-06-19 11:31:38+00:00,日本失心瘋俱樂部,japanuts,1399796788076129,1399796788076129,13,1564.0,336576.0,"第3件事超重要！請大家一定要告訴大家🤣
日本飯店內藏有許多「低調」的貼心設計
如果沒另外用文字標示，真的會讓人一頭霧水！
我整理了三個關於日本飯店的豆知識
希望能幫助到你們，把房內設施使用的更順手💗

近期日本住宿價格都還蠻高的
很多人在問到底怎麼訂比較便宜
其實，用 Visa 訂房就有優惠囉！
使用配合的訂房網站預訂，划算不少呢
省下來的錢，剛好可以拿去吃美食🥰

我把優惠詳情放在下方
正在規劃日本行的朋友，趕緊看看！

【 Visa 日本優惠懶人包 🇯🇵】
🔍 日本優惠總覽：https://lihi1.com/6tulz

｜訂房優惠｜
◼︎Trip.com
使用 Visa 購買機票、訂飯店，可享最高折7%優惠（2025/03/31前）

◼︎Booking.com
刷 Visa 訂房，最高10%刷卡金回饋（2025/12/31前）

◼︎Hotels.com
刷 Visa 訂房，最高享8%優惠（2025/12/31前）

◼︎日本白馬村特別優惠
刷 Visa 享白馬村4大滑雪場1日滑雪票優惠9折，購買PREMIUM BLACK PASS享更多專屬禮遇優惠（2025/2/28前）

#訂房刷Visa #Visa挺你玩遍世界 #日本飯店失心瘋 #日本飯店 #日本住宿 #飯店 #日本自由行 #日本旅遊 #B編",36.57,,2025-01-10 22:10:10+08:00,2025-06-19 19:31:38+08:00,DEpdzuczXv2,Yes,Instaloader
2025-01-11 14:27:18+00:00,2025-02-14 03:53:49+00:00,日本失心瘋俱樂部,japanuts,819428934523443,819428934523443,4,1488.0,225304.0,"這三樣真的好實用
趕快筆記下來去日本買🤘

1. Neko Like 貓咪熱水袋
這個是蓄熱式熱水袋，只要插電就能用
充電15分鐘就能以55℃保持8小時(棉被內)
算是非常節省電費的保暖方法
而且貓咪造型超可愛，抱在身上像真的貓咪
摸起來還會晃來晃去，真的像寵物一樣

2. tutuanna 造型發熱衣
他們家有好多款造型比較好看的發熱衣
領口或袖口做了蕾絲或花邊的設計
露出來的地方不會很死板，反而有造型
而且雖然材質很薄，但內裡卻是毛毯料子
穿起來超保暖，還有平肩款可搭配小禮服穿

3. 腹部暖暖貼 
這款是okamoto推出的腹部暖暖貼
可以讓女生貼在內褲內側，溫暖子宮
薄薄的彎月形，貼在內側不會露出，很剛好
常常會經痛或冬天想保持腹部暖活的話很適合

#冬季 #保暖 #日本 #チュチュアンナ #tutuanna #nuku2 #ぬくぬく #蓄熱式エコ湯たんぽ #nekolike #女性下着 #温女子",19.5,,2025-01-11 22:27:18+08:00,2025-02-14 11:53:49+08:00,DEsEQTjTbFg,Yes,Instaloader
2025-01-12 14:16:03+00:00,2025-02-14 03:53:49+00:00,日本失心瘋俱樂部,japanuts,1940668269867240,1940668269867240,5,1875.0,268296.0,"第5款太特別了！愛地瓜的不要錯過欸🍠
這種冷天很需要喝個熱飲暖一下
我從日本超市盲選5款
沒喝過的沖泡飲回來試試
有糖、無糖都有喔，其中幾款真的不錯
即將去日本玩的朋友快手刀收藏！

歡迎留言跟我推薦
你愛喝的日本沖泡飲品☕️

想看更多日本旅遊資訊► @japanuts

＠nittohblacktea.jp @ogawasyouyaku @vanhouten.cocoa
#food失心瘋 #日本伴手禮 #日本旅遊 #日本自由行 #日本超市 #日東紅茶 #B編",54.24,,2025-01-12 22:16:03+08:00,2025-02-14 11:53:49+08:00,DEuoEQozhA8,Yes,Instaloader
2025-01-13 14:29:07+00:00,2025-10-09 07:13:48+00:00,日本失心瘋俱樂部,japanuts,1279549867357467,1279549867357467,853,1516.0,199102.0,"已經不能沒有它了
行李運送實在太方便
用過一次就愛上😘

自從開始用行李運送後
真的減少我很多的麻煩
我把自己的心得整理給你們
如果你們也有這些困擾
真的可以試試看這個服務

1. 下飛機就能直奔景點或購物 
2. 不用先去飯店，浪費時間和車錢 
3. 不用帶行李搭車搬上搬下耗體力 
4. 不用擔心找不到電梯出口、只有樓梯 
5. 就算下雨也能好好撐傘、不狼狽 
6. 不用在路上辛苦拖著行李箱 
7. 搭車沒有大行李，方便脫掉厚外套 
8. 不怕臨時找不到寄物櫃（或已滿）
9. 不怕帶行李搭車造成別人上下車不便 
10. 沒有負擔、移動方便就是爽 
加碼：（獨旅時）不用帶行李進廁所 

我用的是 #airporter 的行李運送
目前在東京、大阪、京都、札幌、沖繩，都可以利用他們的服務喔！
包含「成田－東京市區」
「羽田－東京市區」
「關西空港－大阪市區」
「關西空港－京都市區」
「大阪市區－京都市區」
「新千歲機場－札幌市區」
「那霸機場－沖繩市區」

用失心瘋專屬連結預約可享95折優惠
不用輸入優惠碼，非常方便
👉留言或私訊索取都可以
歡迎已經用過的朋友來分享實際心得喔！

#日本 #東京 #行李 #行李運送 #luggage #luggages #luggagedelivery #お荷物 @airporter_official",27.53,{'0': '25888907890738219'},2025-01-13 22:29:07+08:00,2025-10-09 15:13:48+08:00,DExOAshTQIm,Yes,Instaloader
2025-01-14 15:03:35+00:00,2025-07-31 09:04:48+00:00,日本失心瘋俱樂部,japanuts,1371623348053784,1371623348053784,25,5458.0,1071525.0,"去 #沖繩 到底要買什麼？！
伴手禮10選分享給你們❤️
私心推薦第2、4、9個

先把這篇收藏起來！
之後再去大買一波吧😍

更多日本旅遊資訊► @japanuts

 #沖繩 #伴手禮 #okinawa #紅薯 #黑糖 #鹽 #日本旅遊 #日本自由行 #travel失心瘋 #food失心瘋 #瑤編",45.02,,2025-01-14 23:03:35+08:00,2025-07-31 17:04:48+08:00,DEz3EJ7v2HZ,Yes,Instaloader
2025-01-15 14:06:55+00:00,2025-02-14 03:53:49+00:00,日本失心瘋俱樂部,japanuts,1458019882429344,1458019882429344,17,1406.0,191987.0,"馬上收藏！去日本不要錯過這3間高質感選物店
我每次進去逛完，戰利品都超～多～🥰
日本現在有很多店家都能直接使用 Visa 結帳
能夠節省結帳找零的時間
將省下的時間來逛更多高質感好物！

這3間選物店精選來自日本各地的好物
種類豐富，廚房、浴室、臥室等相關用品都很齊全
就連食品也都有唷，好逛的不得了❤️
我覺得他們選品風格很不一樣
如果有時間的話，三間都去看看吧！

日本旅遊用 Visa 有專屬優惠唷
優惠內容我整理在下面了
你們快手刀筆記起來，免得忘記啦

【 Visa 日本優惠懶人包 🇯🇵】
🔍 日本優惠總覽：https://lihi1.com/6tulz

｜訂房優惠｜
◼︎Trip.com
使用 Visa 購買機票、訂飯店，可享最高折7%優惠（2025/03/31前）

◼︎Booking.com
刷 Visa 訂房，最高10%刷卡金回饋（2025/12/31前）

◼︎日本白馬村特別優惠
刷 Visa 享白馬村4大滑雪場1日滑雪票優惠9折，購買PREMIUM BLACK PASS享更多專屬禮遇優惠（2025/2/28前）

#訂房刷Visa #Visa挺你玩遍世界 #travel失心瘋 #日本購物 #日本逛街 #中川政七 #日本自由行 @nakagawamasa7 @cibone_ts @akomeya_tokyo",37.61,,2025-01-15 22:06:55+08:00,2025-02-14 11:53:49+08:00,DE2VabCy_R0,Yes,Instaloader
2025-01-16 13:58:18+00:00,2025-07-06 20:28:59+00:00,日本失心瘋俱樂部,japanuts,973336972042556,973336972042556,100,3983.0,373550.0,"住這去南青山、原宿、澀谷逛街都好快速！
走路10分鐘就能到時髦高級的 #南青山 購物
一路逛上去就是原宿表參道😍
飯店距離澀谷也非常近，搭乘銀座線只要2站
再多坐幾站就是銀座，完全不用轉車
地理位置相當不錯！！！
準備要去東京大買特買的朋友，請快收藏起來
​
* ​ ⁎ ⁎ ​ * ​ ⁎ ⁎ ​ * ​ ⁎ ⁎ ​ * ​ ⁎ ⁎ ​ * ​ ⁎ ⁎
這間是👉🏻📍東急STAY 青山 PREMIER
（TOKYU STAY Aoyama Premier）
* ​ ⁎ ⁎ ​ * ​ ⁎ ⁎ ​ * ​ ⁎ ⁎ ​ * ​ ⁎ ⁎ ​ * ​ ⁎ ⁎
​
東急 STAY 特色之一就是房內有洗烘衣機和小廚房
住客可以自己在房間清洗髒衣服
不用去排公用的洗衣機台
還能夠到附近超市買食材回到房內簡單料理
特別適合有長時間住宿需求的人👏🏻
​
我這次入住雙人房，覺得它房間大小剛剛好
行李箱放在走廊上可以輕鬆開啟
購物完的戰利品也有地方能擺放
床邊還有沙發區可以用餐、化妝
能利用的空間不少，住起來很舒服
​
對了，飯店位於明治神宮外苑附近
走路10分鐘即可抵達
秋季來的話，可以順便安排去賞銀杏喔！
​
⚠️訂房省錢技巧：
使用 #日本第一樂天旅遊 訂房
結帳時輸入優惠碼『JAPANUTS2024-2』
就可以享有 #88折優惠 唷
整趟旅程的住宿訂下來省超多
快手刀存起來！！！
​
｜樂天旅遊 優惠碼使用規則｜
❣️每支帳號的使用次數不限
❣️此優惠只開放給台灣的樂天會員使用
❣️優惠券使用期限到2024/12/31截止
❣️旅遊期間在2024/5/15～2025/6/30都可使用
❣️此優惠限定用於「日本」訂房，其他國家不適用！
​
#travel失心瘋 #東京住宿 #青山 #南青山 #原宿住宿 #青山住宿 #東京購物 #失心瘋日本飯店 #日本飯店 #日本住宿 #日本自由行 #東京飯店 #樂天旅遊 #rakutentravel #B編",34.5,,2025-01-16 21:58:18+08:00,2025-07-07 04:28:59+08:00,DE45HciTCOo,Yes,Instaloader
2025-01-17 14:32:51+00:00,2025-02-14 03:53:49+00:00,日本失心瘋俱樂部,japanuts,1272429304740754,1272429304740754,25,8999.0,832058.0,"你們看！浮世繪富士山橡皮擦也太可愛了吧😍
隨著使用，山頭就會慢慢浮現出來
變成 #富士山 的模樣！！🗻
再裝進橡皮擦套裡
就能得到一幅立體的浮世繪🤩
這叫人怎麼能不收藏
富士山迷肯定要擁有一組的吧～

從今以後都開始用鉛筆書寫
擦到手酸都沒關係！🤣
更多有趣的日本資訊► @japanuts

 #富士山 #橡皮擦 #葛飾北斎 #日本文具 #PLUS #zakka失心瘋 #瑤編",27.98,,2025-01-17 22:32:51+08:00,2025-02-14 11:53:49+08:00,DE7h72fTyvA,Yes,Instaloader
2025-01-18 14:21:01+00:00,2025-10-11 17:21:58+00:00,日本失心瘋俱樂部,japanuts,2627405780991968,2627405780991968,7,2918.0,204304.0,"來沖繩旅遊不要只留在本島！
這個離島周圍的海水超清澈、超漂亮✨
它名叫「 #久米島 」
是潛水客的勝地
也是出產海葡萄及車蝦的重地呦！

這次去吃了島上培育出的海葡萄
顆顆飽滿，都沒癟掉！
咬起來有嗶嗶啵啵的口感
配上專門醬油，有種在吃蝦卵的錯覺🤤
從這裡養殖出的蝦子我覺得吃起來也比較鮮甜！
肉質相當Ｑ彈，是吃過一次就忘不掉的美味
東京市場許多販售的車蝦就是從久米島直送的喔！

詢問之後才知道
可以出產如此高品質的海產
是因為他們都使用「 #海洋深層水 」來做養殖！
海洋深層水是指水深 200 公尺以下的海水🐋
一開始抽取上來是為了做發電
但不想浪費抽取上來的海水
所以當地將此運用在各個產業上
除了海產的養殖外，還有培育多種藻類
甚至與產品做結合，例如：食品、保養品...
連飲用瓶裝水中也都富含海洋深層水！
剩餘的海水會再運回海洋，變成永續循環😲
一開始想到這個永續發展的人實在是太厲害了！

久米島很適合去放空渡假
悠悠地在海邊感受慢活風情🏖
非常推薦可以搭觀光玻璃船
到一旁的無人沙洲「終端之濱」
那裡的沙灘是用相機拍不出來的夢幻🥹
幸運的話，路途上還會看到海龜在一旁游泳喔！

這裡從 #那霸機場 搭飛機
只要30分鐘就可以抵達！超快的！一下就到了
下次去沖繩也安排一趟久米島的跳島之旅吧🤍

#kumejima #久米島 #海洋深層水 #海葡萄 #車海老 #明蝦 #斑節蝦 #日本旅遊 #沖繩 #離島 #travel失心瘋 #瑤編",44.17,,2025-01-18 22:21:01+08:00,2025-10-12 01:21:58+08:00,DE-EyLYzPaD,Yes,Instaloader
2025-01-19 14:44:57+00:00,2025-02-14 03:53:49+00:00,日本失心瘋俱樂部,japanuts,1469449798087162,1469449798087162,371,4906.0,366799.0,"又到了去日本爆吃草莓的季節了🍓
草莓基本上在一般超市都找得到
不過，大型超市品種選擇會更多唷！！！

我前幾天在紀ノ国屋超市發現一張草莓圖鑑
上面有寫出各品種的甜度、香氣對照表
需要參考的朋友，可以私訊我唷🥰

快傳給要去日本的朋友
請他們不要錯過吃日本草莓的好機會💗
想看更多日本旅遊資訊► @japanuts

#food失心瘋 #日本草莓 #いちご #草莓 #日本自由行 #日本旅遊 #日本必吃 #日本水果 #B編",12.75,,2025-01-19 22:44:57+08:00,2025-02-14 11:53:49+08:00,DFAs6dETg0Z,Yes,Instaloader
2025-01-20 14:13:30+00:00,2025-07-24 03:21:43+00:00,日本失心瘋俱樂部,japanuts,1869793457075479,1869793457075479,7,4709.0,868834.0,"一起來逛沖繩人的廚房！第一牧志公設市場！
這裡重新整修後真的大大升級✨
整體環境變得很乾淨，逛起來舒適度大幅提升！
分享給你們我覺得必買的三間店
第一間的沖繩名產 #花生豆腐
和第二間的沖繩傳統點心 #沙翁
都是每日限量，售完就沒了🥹
強烈建議大家早點去買！

沒買到也沒關係
外面的 #市場本通り 也有很多店鋪可以逛
另外推薦兩間店給大家❤️
趕快點進影片裡看看吧！

｜沖繩第一牧志公設市場｜
地址：沖繩縣那霸市牧志3-1-1
營業時間：8:00～22:00
毎月第4個週日公休 (12月無公休）

 #沖繩 #第一牧志公設市場 #花生豆腐 #じーまーみ豆腐 #步沙翁 #大城屋 #沖繩產直市場 #松原屋製菓 #日本旅遊 #日本自由行 #travel失心瘋 #food失心瘋 #瑤編",45.18,,2025-01-20 22:13:30+08:00,2025-07-24 11:21:43+08:00,DFDOHF_zuMK,Yes,Instaloader
2025-01-22 14:28:54+00:00,2025-02-14 03:53:49+00:00,日本失心瘋俱樂部,japanuts,1253894972840616,1253894972840616,1,1198.0,163621.0,"我要瘋了！這裡真的太好買🥰
喜歡日本緣起物的朋友，趕快找時間去逛！
裡面超多招財貓、達摩和招財狸貓
還有比較少見的造型樣式唷
要不是行李空間有限，我真想全部買回家💗

📌店名在影片裡，記得看到最後！
📌日本緣起物可能為新年特別選品，期間過了有可能不會販售

想看更多日本旅遊資訊► @japanuts

2025.01.22
#zakka失心瘋 #達摩 #招財貓 #狸貓 #日本招財貓 #澀谷 #澀谷購物 #B編",18.97,,2025-01-22 22:28:54+08:00,2025-02-14 11:53:49+08:00,DFIZf-xTzot,Yes,Instaloader
2025-01-24 14:25:57+00:00,2025-07-05 02:32:36+00:00,日本失心瘋俱樂部,japanuts,792463710002091,792463710002091,15,3217.0,641662.0,"一次買齊 #沖繩伴手禮 的好去處！
之前發了伴手禮10選～
很多人詢問是在哪裡買的😆
這三處推薦給你們！
沒時間逛街，或是不想跑太多點的人
走進這三間店基本上就可以搞定👌🏻

趕快分享給要去沖繩玩的朋友吧！
看更多日本旅遊資訊►追蹤 @japanuts

 #沖繩 #伴手禮 #お土産 #唐吉訶德 #沖繩屋 #那霸MainPlace #日本旅遊 #日本自由行 #travel失心瘋 #瑤編",35.18,,2025-01-24 22:25:57+08:00,2025-07-05 10:32:36+08:00,DFNiwCeTrqH,Yes,Instaloader
