creation_time,modified_time,post_owner.name,post_owner.username,id,media_id,statistics.comment_count,statistics.like_count,statistics.views,text,duration,tags,creation_time_tw,modified_time_tw,short_code,is_file_exist,DownloadTool
2025-08-12 11:55:00+00:00,2025-08-13 11:25:06+00:00,黃小米 Mii,lovemiihuang,911852964573162,911852964573162,263,,105123.0,"頭頂的髮線會洩漏年紀啊啊啊🥹
有沒有人跟我一樣有掉髮困擾？

幾年前我意識到這個問題
就開始找好用的頭皮保養產品
那時候一用到巴黎卡詩的 #粉漾芯生頭皮調理精華
真的直接愛上！大推給身邊的朋友
我的空空賞單元也出現好幾次（是真愛）

它讓我的落髮狀況改善超級多！
連去弄頭髮造型師都問我「最近用了什麼產品？」
髮根變得比較強壯跟蓬鬆了
看來這個錢沒白花

顧好髮質很重要，但更多人會忽略的是”頭皮”
頭皮一垮臉也會跟著垮...
這次巴黎卡詩帶來全新的頭皮精華使用方式
「粉漾奢養髮肌6步驟」
在使用頭皮精華時，搭配簡單的頭皮按摩
除了可以提升產品吸收，還可以放鬆舒緩一天的緊繃
已經是不能或缺的生活儀式感了🖤

如果不知道自己適合哪款產品
現在巴黎卡詩也有專業的頭皮檢測儀
可以測毛囊健康、頭皮出油皮屑等問題
給你最專業的保養建議
大家有興趣一定要試試！

@kerastase_official
#巴黎卡詩 #頂級沙龍專屬  #頭皮秀髮奢養專家 #8倍穩固髮根  #粉漾奢養髮肌6步驟",69.57,,2025-08-12 19:55:00+08:00,2025-08-13 19:25:06+08:00,DNQQn6ozFKQ,Yes,Instaloader
2025-08-13 12:00:00+00:00,2025-08-15 13:13:00+00:00,黃小米 Mii,lovemiihuang,896292193140967,896292193140967,9,,109892.0,"為什麼感情裡被罵的總是第三者？
-
完整節目🔍【小週末開Pod】EP.9
⏰每週三晚上8點準時更新
🎧YouTube/Podcast/Spotify/KKBOX同步更新
讓我們陪伴大家輕鬆度過每個小週末

IG追蹤起來 <redacted_mention>",24.82,"{'0': 'non_public_2289964658199320', '1': '931839865723982'}",2025-08-13 20:00:00+08:00,2025-08-15 21:13:00+08:00,DNS1_Nrz5XC,Yes,Instaloader
2025-08-16 12:30:18+00:00,2025-08-18 22:50:24+00:00,黃小米 Mii,lovemiihuang,1256548976417614,1256548976417614,26,,179767.0,學廢了嗎🤓,6.73,"{'0': 'non_public_882604491267717', '1': '931839865723982'}",2025-08-16 20:30:18+08:00,2025-08-19 06:50:24+08:00,DNaneILzEFz,Yes,Instaloader
2025-08-19 12:32:19+00:00,2025-08-19 17:22:25+00:00,黃小米 Mii,lovemiihuang,1960036398226366,1960036398226366,39,,116952.0,"今天跟我一起來化妝🥰
最近很愛這種乾乾淨淨的裸色妝容

每年都不能錯過的DIOR限量彩妝系列
2025官網獨家以MISS DIOR塗鴉標誌為靈感
推出三種限量色選：黑、裸、粉
（難得看到精品彩妝出帥帥的黑色好喜歡🖤）

不過我今天要畫的是更日常的妝容
用經典五色眼影664時尚裸
這盤的米跟粉都是超級實用的中間色
想要更有層次也能加上珠光棕跟深咖
點綴閃片加上立體度
眼妝就會簡簡單單的但又很有層次感
是一盤濃淡皆宜的多用途眼盤

限量系列也有出晶透光氣墊、癮誘唇膏的限定外殼
我真的要大推428這色調得超級美！
有氣色又很質感耐看

你們喜歡這個妝容嗎？留言跟我說

@DiorBeauty
#DIOR官網獨家販售 #MissDior彩妝",39.94,,2025-08-19 20:32:19+08:00,2025-08-20 01:22:25+08:00,DNiWOTMTuIP,Yes,Instaloader
2025-08-21 12:23:18+00:00,2025-09-29 11:26:49+00:00,黃小米 Mii,lovemiihuang,781177551206362,781177551206362,35,2241.0,321383.0,"久違的爆紅實驗室
分享這支我終於收到的瀏海電棒

日本女生很多瀏海造型
所以在那邊直接賣爆
不過我研究出沒有瀏海也可以用的方法
優缺點影片都直接講得清清楚楚囉！

來～下一個想看我分享什麼？

#hair #japan 
#瀏海電棒 #小米美妝筆記",64.8,,2025-08-21 20:23:18+08:00,2025-09-29 19:26:49+08:00,DNne2xSzIgx,Yes,Instaloader
2025-08-24 12:49:08+00:00,2025-08-24 16:59:50+00:00,黃小米 Mii,lovemiihuang,1676430540183515,1676430540183515,9,,203328.0,"想不到大家去首爾都吃這個…🤤

#小週末街坊",85.03,"{'0': 'non_public_2289964658199320', '1': '931839865723982'}",2025-08-24 20:49:08+08:00,2025-08-25 00:59:50+08:00,DNvPsQa5ik5,Yes,Instaloader
2025-08-25 12:16:45+00:00,2025-09-16 15:58:40+00:00,黃小米 Mii,lovemiihuang,1622531159074831,1622531159074831,67,2735.0,161280.0,"美妝圈大事件我怎麼能錯過🔥
Louis Vuitton推出彩妝系列啦！

立刻來拍開箱上妝給你們看

之前用Pat McGrath的唇膏就很喜歡
這次LV ROUGE也沒有讓我失望
奶霜質地非常之滑順
很顯色服貼、上唇舒適度也很高
薄擦一層跟厚塗各有風情

頂部透明包裝透視內裡膏體的顏色
配上金環品牌標誌紋路
精品感十足（價格也是很精品）

LV OMBRES眼影也讓我很驚艷
質地一抹是那種很服貼又滑順的觸感
濃郁的色彩卻很好暈染
還偷偷拿中間色當腮紅擦
粉質夠細緻不用擔心顯毛孔

喜歡這個妝容嗎？

@louisvuitton 
#makeup #LouisVuitton #LaBeauté
#LV彩妝 #小米美妝筆記",26.91,"{'0': '373831315529432', '1': '253599381036176'}",2025-08-25 20:16:45+08:00,2025-09-16 23:58:40+08:00,DNxxLeU5pIZ,Yes,Instaloader
2025-08-26 13:12:11+00:00,2025-09-19 06:30:46+00:00,黃小米 Mii,lovemiihuang,1900655683878391,1900655683878391,217,5069.0,115719.0,"#文末米粉好康
你們知道最難的妝容是什麼嗎？
錯！不是煙燻妝
我覺得是「看起來沒什麼化，
但其實你根本不是素顏」的精緻裸妝

底妝要乾淨我很愛找日本品牌
每次去逛藥妝店發現佳麗寶黑色KANEBO系列常常會上榜
尤其這罐粉霜，終於讓我給用到了

#KANEBO無瑕妍采活力肌粉霜II
日雜跟美妝大賞評價超級好的肌粉霜
我實際用了之後就懂～這就是融入皮膚的感覺啊
你們看根本沒什麼粉感
但完妝後的保濕度跟自然光澤
默默的讓肌膚質感更上一層樓

順便分享最近很愛的 #KANEBO渲影漸層眉彩粉 EG1
本來想說市面上眉粉這麼多
結果一用直接驚艷
它超級好暈！又超服貼不結塊
連眉頭都能自然地畫出漂亮漸層感
也能拿來當眼影，深邃的眉眼妝容一盤搞定

🎁最近還有送眉彩刷跟化妝包的活動
喜歡這個妝感的話，趕快去靠櫃試試吧！

#米粉好康
現在追蹤 @kanebotaiwan 
按讚＋留言新品燒到你的原因
要送出訂製造型刷＋眉彩粉（不挑色）一組！

#kanebotaiwan  #KANEBO肌粉霜 #KANEBO眉彩粉",64.04,,2025-08-26 21:12:11+08:00,2025-09-19 14:30:46+08:00,DN0cbQV5qYk,Yes,Instaloader
2025-08-31 12:33:32+00:00,2025-09-03 04:34:23+00:00,黃小米 Mii,lovemiihuang,949983144050608,949983144050608,9,,141747.0,"30秒挑選粉底懶人包
幫你把今年熱門的專櫃粉底都整理好了！

完整介紹上妝可以到YouTube唷🫰🏻

#makeup #專櫃粉底 #小米美妝筆記",28.35,,2025-08-31 20:33:32+08:00,2025-09-03 12:34:23+08:00,DOBPiAZEzTW,Yes,Instaloader
2025-09-01 11:39:57+00:00,2025-09-04 06:39:44+00:00,黃小米 Mii,lovemiihuang,2426784061075699,2426784061075699,60,3002.0,250732.0,"連膝蓋瘀青都遮得掉的氣墊
是不是很狂！

我從去年就愛用到現在的
M·A·C超持妝霧絲絨氣墊粉餅 #AI小黑碟
最近有全新限量 #未來銀 外殼顏色新選擇啦

它真的好適合台灣夏天這種逼死人的天氣
我用的色號是N18，質地非常滑順好延展
防水又防汗、不容易蹭妝也很清爽
加上76%護膚成分
持妝同時又兼顧保濕度
上臉比較不容易拔乾

先用超奇肌修護花瓣精萃 #花瓣精萃 ＋超漾光高防曬妝前乳 #超漾光妝前乳
mix混合起來打底，保濕同時又有SPF50+PA+++防曬防護力
接著上氣墊，鑽石粉撲連邊邊角角都上得很精準
光拍一層就很像套濾鏡！
最後用口袋雙色濾鏡蜜粉餅 #紫白餅 定妝
透明白上在T字部位、絕絕紫針對兩頰平滑提亮

這個底妝組合在夏天超安心
出門走跳一整天也不怕底妝毀掉
這就是為什麼我喜歡M·A·C氣墊
推薦給喜歡遮瑕持妝底妝的人🫶🏻

@maccosmeticstaiwan 
#未來銀AI小黑碟  #CanYouFoundationDoThis
#MAC氣墊挑戰賽 #IOnlyWearMAC #MACStudioFix",64.46,,2025-09-01 19:39:57+08:00,2025-09-04 14:39:44+08:00,DODuTQCE5KS,Yes,Instaloader
2025-09-02 12:45:27+00:00,2026-01-10 09:21:46+00:00,黃小米 Mii,lovemiihuang,1438664217800032,1438664217800032,43,,88657.0,"什麼東西沒帶出門你會崩潰
我是...

各位～我的愛牌DIOR出新唇膏了!!!

#迪奧巨星持色唇膏
鏡面細長管身
質地抹起來超～滑順，連打底都不用
我特別喜歡水滴斜角膏體設計
很簡單就能畫出好看的唇周輪廓線

妝感是閃耀的鏡光
既顯色又能暈染成漸層唇妝

總共出了8色
其中主打色 #390 我最推薦
溫潤的玫瑰裸色、上唇氣場全開
襯托膚色剛剛好
還有柔柔淡淡的裸米色 #120
也很適合日常擦、非常百搭

📢全新《迪奧巨星持色唇膏》9/1於「全台迪奧專櫃」閃耀登場  凡購買兩支唇膏含任一支《迪奧巨星持色唇膏》
即可獲得Rouge Dior隨身鏡乙個 

@DIORBEAUTY @DIORBEAUTYLOVERS 
#DIORMAKEUP #ROUGEDIOR",26.47,{'0': '2330311334025904'},2025-09-02 20:45:27+08:00,2026-01-10 17:21:46+08:00,DOGawrvExQV,Yes,Instaloader
2025-09-07 13:46:06+00:00,2025-09-13 14:56:11+00:00,黃小米 Mii,lovemiihuang,2689726728052319,2689726728052319,28,8113.0,200232.0,"Monza we’re coming🇮🇹🏎️
不敢相信我們真的來到現場了!!!!!",11.52,"{'0': 'non_public_882604491267717', '1': 'non_public_926011310121904'}",2025-09-07 21:46:06+08:00,2025-09-13 22:56:11+08:00,DOTZl1NDLsM,Yes,Instaloader
2025-09-08 13:42:17+00:00,2025-09-10 14:42:22+00:00,黃小米 Mii,lovemiihuang,1153443810087783,1153443810087783,21,,102704.0,"怎麼挑一款好用的妝前乳？

很多人都會把重點放在粉底液
但其實妝前乳挑得好
粉底用量更省、也能讓底妝更服貼持久（畫螢光筆）

我自己會在意的幾個重點：

✔️潤色自然不泛白
皮膚蠟黃可以選玫瑰粉色，讓氣色更紅潤
✔️質地要清爽
台灣天氣這麼熱，不黏膩帶妝時間長膚觸才舒服
✔️保濕力
所有膚質都要保濕，才能讓底妝更服貼

今天分享一個妝前乳模範生
BOBBI BROWN新品 #冬蟲夏草精華亮膚持妝乳
最近推出玫瑰粉潤色款啦！

除了上面的重點都有兼顧之外
它也是第一支粉紅中藥妝前乳
還有添加冬蟲夏草精萃提升肌膚亮澤度
加上維他命E、植萃醣、紅藻等養膚成分
所以會越擦越漂亮✨

如果還沒找到喜歡的妝前乳
推薦你們這款妝前打底神隊友
根本是熬夜的急救神器！

@BOBBIBROWNTAIWAN
#BOBBIBROWNTAIWAN",67.34,,2025-09-08 21:42:17+08:00,2025-09-10 22:42:22+08:00,DOV-ELeDFiB,Yes,Instaloader
2025-10-01 12:26:16+00:00,2025-10-03 13:16:24+00:00,黃小米 Mii,lovemiihuang,918954637507215,918954637507215,23,,188952.0,"新婚到現在跟別人聊天
還是很不習慣稱呼P哥是「我老公」😂

以往給你們的印象可能是整理筆記控
所以常常看到都是比較資訊類型的影片
接下來也想分享更多我的想法、生活、價值觀

八月初開始默默的把生活記錄下來
想在平常分享美妝之餘
讓你們更多參與我的生活
還有很多私底下不為人知(?)的一面

小夫妻日常Vlog已經在YouTube上映囉
非常輕鬆愉快的一集
歡迎配飯、配化妝或吹頭髮觀賞🫰🏻

喜歡的留言喜歡讓我知道🤍",28.1,{'0': 'non_public_882604491267717'},2025-10-01 20:26:16+08:00,2025-10-03 21:16:24+08:00,DPRDZZGE4Fq,Yes,Instaloader
2025-10-07 12:27:16+00:00,2025-11-12 15:33:25+00:00,黃小米 Mii,lovemiihuang,26068509669481580,26068509669481585,159,2114.0,127372.0,"這是我在義大利的第一天🇮🇹

義大利連載開始!!!
我心中的旅遊清單再打一個勾
這趟連續14天的旅程，拍了滿滿影片素材
之後會在IG發每日連載短片
每個城市也會有Vlog長片

我們帶了單眼、Pocket3、空拍機，Gopro還有兩支手機
整理上千個檔案時真的是邊崩潰邊開心😂
但也覺得很值得，因為下次去不知道什麼時候了

想把我在旅途中看到玩到的分享給你們
不管有沒有計畫要去義大利
都不要錯過啦！

有沒有開始期待下一集了？

#italy #milan #vlog #navigli 
#義大利自由行 #米蘭 #米蘭運河區",43.75,{'0': 'non_public_882604491267717'},2025-10-07 20:27:16+08:00,2025-11-12 23:33:25+08:00,DPgglxBE4IS,Yes,Instaloader
2025-10-08 12:34:30+00:00,2025-10-10 01:34:37+00:00,黃小米 Mii,lovemiihuang,964201052602055,964201052602055,78,,84411.0,"義大利的第二天🇮🇹

猜對了嗎？我們來到米蘭大教堂
今天分享3個都市傳說
結果第三個直接被我破解了嘿嘿

這裡真的是米蘭必訪景點
強力推薦買含露台的門票（不想爬樓梯記得買電梯版）
可以更身歷其中感受建築的細膩
也能欣賞米蘭市景

聽說還有個拿破崙小雕像
可惜我們沒有找到
有去參觀的可以探索看看！

明天～我們要前往近郊
去一個超級美的小鎮😍

#italy #milan #vlog #milanduomo
#義大利自由行 #米蘭 #米蘭大教堂",62.72,{'0': 'non_public_882604491267717'},2025-10-08 20:34:30+08:00,2025-10-10 09:34:37+08:00,DPjGLAhE5X5,Yes,Instaloader
2025-10-10 12:03:33+00:00,2025-10-10 12:43:38+00:00,黃小米 Mii,lovemiihuang,26178110991825600,26178110991825602,99,,93731.0,"義大利的第三天🇮🇹

義大利人會不會太幸福
從米蘭市區搭車一小時就可以到這麼美的地方

科莫湖是這趟旅程中我很喜歡的景點之一
空氣中瀰漫著悠閒的氛圍
強迫我們這些都市人慢下腳步
好好感受這份恬靜

沿著湖的周邊有很多小鎮
我們挑了瓦倫納Varenna跟貝拉焦Bellagio
私心很推瓦倫納！
人潮比較沒那麼多，景色也很美
（到時候Vlog上線有更多完整分享）

溫馨小叮嚀
最好先訂好火車票跟事先查好船班時間
當地很常會突然有罷工、誤點的狀況
也要預留出發時間，才不會匆匆忙忙

明天～就是P哥這趟最期待的行程啦！

#italy #milan #vlog #como #lakecomo
#義大利自由行 #科莫湖",63.04,{'0': 'non_public_882604491267717'},2025-10-10 20:03:33+08:00,2025-10-10 20:43:38+08:00,DPoMKrEk2Lc,Yes,Instaloader
2025-10-12 12:02:13+00:00,2025-10-15 15:22:19+00:00,黃小米 Mii,lovemiihuang,1273584760801634,1273584760801634,51,,78184.0,"（開聲音看更精彩🔊）
現場看F1是什麼體驗？
我只能說太值得了!!!!!

這是我們在義大利的第四天🇮🇹
前往蒙札賽車場看F1
必須說在法拉利主場真的很有氛圍
不時會看到各種紅色dresscode

以前都是看轉播
這次親自坐在現場真的太震撼了
那個飆車引擎聲、現場觀眾的熱情歡呼聲
腎上腺素會直接飆高那種🔥

✔️給之後有計劃要去的人一些攻略心得
-車票務必先買好，當天買很容易沒票
-要穿好走的鞋，跟要走很多路的心理準備
-當然防曬也要預備好
-記得帶水，現場也有飲水機
-耳朵很敏感可以備著耳塞，但我們是很享受現場音啦

至於座位我覺得很看個人喜好
像我們這次買8A，就是第一個連續彎道
剛好可以看到比較刺激的超車畫面
可以選的話”上排”視野會更好喔！

🎬完整版米蘭Vlog今晚21:00準時上線

#italy #milan #vlog #monza #f1 #ferrari
#義大利自由行 #f1賽車",66.4,{'0': 'non_public_882604491267717'},2025-10-12 20:02:13+08:00,2025-10-15 23:22:19+08:00,DPtVqLREwsX,Yes,Instaloader
2025-10-14 11:28:21+00:00,2025-11-03 03:33:06+00:00,黃小米 Mii,lovemiihuang,929090806337806,929090806337806,79,5717.0,337955.0,"威尼斯的秘密🤫

這是我們在義大利的第五天🇮🇹
前往很期待的新城市>>威尼斯

看過這麼多電影海報
實際身在浪漫水都還是很不真實
真的是去哪裡都要靠船移動

而且錯綜複雜的小巷弄
轉個彎就會看到運河景色
可以說是世上獨一無二的體驗了吧

雖然觀光客真的不少
但我還是會把它列為此生必去的地點之一
因為真的太讓人印象深刻了！

#italy #vlog #Venice 
#義大利自由行 #威尼斯",61.05,{'0': 'non_public_882604491267717'},2025-10-14 19:28:21+08:00,2025-11-03 11:33:06+08:00,DPybbiOk-OA,Yes,Instaloader
2025-10-15 12:00:00+00:00,2025-10-19 00:20:10+00:00,黃小米 Mii,lovemiihuang,1640079020745561,1640079020745561,55,,145580.0,"大家出國通常都會帶持妝的粉底吧？
我這次去義大利帶的粉底
不只持妝、光澤還超美✨

YSL新出的粉光瓶 #恆久完美裸光無瑕粉底露
名稱叫做粉底“露”
保留質地的輕盈滑順度
但剛剛好的遮瑕度，能把膚色不均都遮住
而且也夠服貼
連我比較乾的眼下鼻翼都可以上得好

再搭配 #YSL皮革蜜粉 定妝
這顆我之前就分享過
粉質很細膩～也不會把底妝光澤壓光光

我特別喜歡粉底的成膜特性
既保留臉上的光澤
又能維持住持妝度，隨便蹭也不容易掉妝
你們看到晚上妝感幾乎沒有暗沉
真的是會捨不得卸妝😍

🛒最近週年慶百貨有好康活動
✔️全年唯一任意品類95折
✔️搭配滿千折百活動
✔️粉光瓶接近88折超划算！

🎁只要買YSL粉光瓶，就可獲得品牌美妝磚（只送不賣）
購買粉光瓶與定妝類產品任兩件底妝加送“編織化妝包“

想找一瓶保濕、質地輕盈
遮瑕又不錯的持妝光澤粉底
絕對要試試看！

#yslbeautytw #YSL粉光瓶 #第一支粉底露 #美到捨不得回家",80.27,,2025-10-15 20:00:00+08:00,2025-10-19 08:20:10+08:00,DP1ECl0Ez62,Yes,Instaloader
2025-10-19 11:06:43+00:00,2025-10-23 01:37:33+00:00,黃小米 Mii,lovemiihuang,947053527850371,947053527850371,81,,78079.0,"為什麼這麼多人要來威尼斯度蜜月？
影片看到最後你就知道了

這是我們在義大利的第六天🇮🇹
威尼斯除了本島之外
周邊還有Murano跟Burano兩個外島
時間充裕的話推薦兩個都可以去走走

但比較起來我們都更喜歡Burano彩色島
排排站的房子實在太可愛了🏠

#italy #vlog #Venice 
#義大利自由行 #威尼斯",50.09,{'0': 'non_public_882604491267717'},2025-10-19 19:06:43+08:00,2025-10-23 09:37:33+08:00,DP_Q-08EzEb,Yes,Instaloader
2025-10-21 11:58:58+00:00,2025-10-25 09:49:47+00:00,黃小米 Mii,lovemiihuang,1472780251012955,1472780251012955,64,,76615.0,"佛羅倫斯錯過這個你會哭！
太特別的體驗了😍

這是我們在義大利的第七天🇮🇹
把握在威尼斯的最後一個早上
就要前往下個城市>>佛羅倫斯啦！

車站旁的SMN百年修道院
是全世界最古老的藥妝店始祖
有超過800年歷史！

然後沿著街道隨意晃晃
你會發現有些店家會開個小窗戶
就是Wine Window🍷
敲敲門就可以點酒～會不會太有情調
一定要體驗看看！

#italy #vlog #Venice #Florence
#義大利自由行 #威尼斯 #佛羅倫斯",46.2,{'0': 'non_public_882604491267717'},2025-10-21 19:58:58+08:00,2025-10-25 17:49:47+08:00,DQEgghZk-ku,Yes,Instaloader
2025-10-23 12:12:31+00:00,2025-11-12 15:32:46+00:00,黃小米 Mii,lovemiihuang,903711655773266,903711655773266,62,2166.0,152044.0,"快存！全義大利買精品最便宜的地方
聽到折扣直接傻眼😳

這是我們在義大利的第八天🇮🇹
早上先去中央市場吃牛肚包
再到這裡最有名的聖母百花大教堂朝聖

教堂進去是不用門票的喔（歐洲真難得）
但也因為這樣參觀的人大排長龍
大概繞了教堂快一圈吧～果斷放棄

今天的重頭戲就是The Mall Firenze
整個義大利有好幾間outlet
其中這間精品品牌算是最多最齊全
雖然市區搭接駁車過來要50分鐘左右
但折扣真的很佛！
（我買到一顆miu miu包五折，等我戰利品影片）

推薦至少留半天到一天的時間
趕快分享給你喜歡逛精品的朋友們！

#italy #vlog #Florence #themallfirenze #outlet
#義大利自由行 #佛羅倫斯",37.07,{'0': 'non_public_882604491267717'},2025-10-23 20:12:31+08:00,2025-11-12 23:32:46+08:00,DQJrpodE4Gn,Yes,Instaloader
2025-10-27 12:10:50+00:00,2025-10-29 15:51:31+00:00,黃小米 Mii,lovemiihuang,1617023103046639,1617023103046639,74,,102459.0,"比臉大三明治吃過嗎？

這是我們在義大利的第九天🇮🇹
這天去了好多佛羅倫斯的精華景點

烏菲茲美術館、領主廣場
還有開了四家分店還是排隊排到爆的三明治
（不過不會排太久別擔心）

重頭戲是米開朗基羅廣場
強力推薦可以從傍晚待到天黑！
看到整個城市不同時刻的美
那個畫面到現在還刻在我腦海裡
喜歡到直接換成手機桌布了

這個城市有點文藝又有點浪漫
趕快分享給想去義大利玩的朋友們

#italy #vlog #Florence 
#義大利自由行 #佛羅倫斯 #米開朗基羅廣場",47.27,{'0': 'non_public_882604491267717'},2025-10-27 20:10:50+08:00,2025-10-29 23:51:31+08:00,DQT-qm5Eywt,Yes,Instaloader
2025-10-28 12:13:43+00:00,2025-10-31 15:23:49+00:00,黃小米 Mii,lovemiihuang,1136113481865740,1136113481865740,29,,110676.0,"教你怎麼把直男變浪漫
學廢了嗎？

沒關係～喜歡的東西我們自己買（哼）

最近想買唇彩的米粉們
請把你的目光焦點放在TOM FORD Fucking Fabulous液態唇膏
這支光外型就先擄獲我的心
皮革包裝超有個性！

第一次用就被那個滑順度嚇到
尤其是它固態轉液態的質地
是很沽溜～的那種
塗抹上去的顯色度非常優秀
先貼合你的嘴唇，由水潤再霧化最後變成有點霧光的妝感

一口氣試了五色給你們看
▪️F1 PEONY 裸米色：日常百搭柔和色系 
▪️F2 BLUSH 煙燻粉色：更知性優雅一些
▪️F3 PINK 中性裸暪色：甜美浪漫又帶一點俏皮
▪️F4 CERISE 藕粉色：淡雅氣質有高級感
▪️F5 ROSE 玫瑰深粉色：甜酷小性感有魅力的風格

私心最推薦F1跟F5
一支日常擦很實用、另一支非常襯膚色！
下次去逛街請務必要試試🖤

🎁現在靠櫃購買 F. Fabulous 3支唇膏或是2支 F. Fabulous 唇膏+1個高級訂製四色眼影盤  就能擁有 F. Fabulous 唇膏包！！！  數量有限 送完就沒了 米粉們快衝～～ 

@TOMFORDBEAUTY 
#FuckingFabulous #FuckingFabulous液態唇膏 #TOMFORDBEAUTY #TOMFORDBEAUTYTW",44.63,,2025-10-28 20:13:43+08:00,2025-10-31 23:23:49+08:00,DQWjqGKE5Ye,Yes,Instaloader
2025-10-30 11:15:23+00:00,2026-01-26 16:39:37+00:00,黃小米 Mii,lovemiihuang,4362596487330884,4362596487330884,24,2221.0,172922.0,"找到小白餅平替啦!!!
傳給你的朋友幫他省錢😎

完整上妝影片可以到YouTube🔍開架專櫃雙胞胎12
下一集已經在籌備中囉

#makeup #dupe #小米美妝筆記",16.79,,2025-10-30 19:15:23+08:00,2026-01-27 00:39:37+08:00,DQbmuYSkwhJ,Yes,Instaloader
2025-11-04 11:49:19+00:00,2025-11-09 12:10:23+00:00,黃小米 Mii,lovemiihuang,1680420702926472,1680420702926472,59,,80626.0,"99%台灣人都不知道的隱藏景點
如果你的義大利之旅想跟別人不一樣
那一定要看這篇！

在義大利的第十天🇮🇹
我們選擇當地人的度假勝地「Monte Argentario」
位於佛羅倫斯跟羅馬中間的海港小鎮

喜歡看海接近大自然
擔心逛古蹟逛到審美疲勞的話
可以安排2-3天來這裡走走

#italy #vlog #monteargentario #portoercole 
#義大利自由行 #義大利小鎮",51.5,{'0': 'non_public_882604491267717'},2025-11-04 19:49:19+08:00,2025-11-09 20:10:23+08:00,DQoikaQk4mQ,Yes,Instaloader
2025-11-10 12:10:51+00:00,2025-11-13 00:31:58+00:00,黃小米 Mii,lovemiihuang,3787309471578026,3787309471578026,95,,76241.0,"挑戰不可能任務
一天走完羅馬四個景點!

義大利之旅最終章🇮🇹
因為家裡有事需要提前回台灣
臨時把羅馬重要行程全部排在同一天

我們去了梵蒂岡、羅馬競技場、古羅馬市集跟特雷維許願池

我只能說小朋友不要亂學
要不是趕時間千萬別這樣排
一天走完真的很累...

下次回訪義大利
我一定要再去把羅馬好好玩個透徹🥹

🎁義大利連載米粉好康
只要在這系列短影片下面留言
我會從影片中抽出兩位
送佛羅倫斯買回來的香氛伴手禮唷！

#italy #vlog #Rome #Vatican
#義大利自由行 #羅馬 #羅馬競技場 #梵蒂岡",47.51,{'0': 'non_public_882604491267717'},2025-11-10 20:10:51+08:00,2025-11-13 08:31:58+08:00,DQ4BzpWExIv,Yes,Instaloader
2025-11-14 12:49:09+00:00,2025-11-17 15:29:55+00:00,黃小米 Mii,lovemiihuang,4240881916199543,4240881916199543,128,,106592.0,"開架睫毛膏要$680？值得嗎？

KISSME新出的LASH HYPE睫毛膏
做的是梳狀設計
它可以可貼合睫毛根部，再把睫毛往上撐
讓膏體包覆每根睫毛

我很喜歡它剛好的乾濕度
也可以搭配燙睫毛器，定型效果更讚！
開架有時候會有85折優惠
而且妝效是真的滿好看
有喜歡可以趁現在入手

那如果本身睫毛比較短，喜歡明顯纖長效果的
絕對就是經典的超!持久睫毛膏
這支真的新手友善，無腦刷都ok

順便分享眼線液筆也是我平常的愛用
很抗暈又好畫！

千萬不要小看睫毛這個步驟
可以讓眼睛默默變有神又放大
下次逛開架可以買來試試看😍

@kissme.heroinemake
#KISSME花漾美姬 #日本全眼妝專家 #Lashhype睫毛膏 #風暴級濃密捲翹 #超持久睫毛膏 #更長更翹更持久",67.76,,2025-11-14 20:49:09+08:00,2025-11-17 23:29:55+08:00,DRCUYzrE95U,Yes,Instaloader
